기사 제목,내용,링크
“뉴스는 담당자 숙취로 쉽니다” 엄숙한 제약업계의 파격 변신,동아쏘시오그룹 텔레그램 채널 등 젊은 감성 무장 파격적 홍보 눈길 20~30대 겨냥한 쇼츠도 인기몰이 ‘썸남 앞에서 트림 할 뻔한 사연’을 담은 ‘베나치오’ 유튜브 쇼츠 [동아제약 유튜브] “오늘 뉴스는 담당자 숙취,https://n.news.naver.com/mnews/article/016/0002458112
[그래픽] 미국-중국 주요 수출 규제 현황,도널드 트럼프 미국 행정부가 인공지능(AI) 칩 선두 주자 엔비디아 H20 칩의 중국 수출을 제한했다. 전세계를 상대로 관세전쟁을 벌이고 있는 트럼프 행정부가 중국에 대한 압박을 강화한 것으로 풀이된다. yoon2@,https://n.news.naver.com/mnews/article/001/0015333211
"삼성SDS, '인더스트리 데이’ 개최…제조 산업의 디지털 미래 제시",삼성SDS는 서울 송파구 잠실 스카이31 컨벤션에서 제조 기업을 대상으로 '제조의 미래를 준비하는 삼성SDS 인더스트리 데이'세미나를 개최했다고 16일 밝혔다. 제조 기업 IT 담당자 300여명이 참석한 이날 행사에,https://n.news.naver.com/mnews/article/003/0013186717
"삼성SDS, ‘Industry Day’에서 제조 기업의 미래 제시",삼성SDS는 16일 잠실 스카이31 컨벤션에서 제조 기업을 대상으로 ‘제조의 미래를 준비하는 삼성SDS Industry Day’ 세미나를 개최했다고 밝혔다. 이번 세미나는 삼성SDS만의 차별화된 생성형 인공지능(AI,https://n.news.naver.com/mnews/article/014/0005336716
"카카오뱅크, 키움증권과 MOU 체결…""투자 서비스 결합 강화""",카카오뱅크가 키움증권과 투자 서비스 결합을 강화하는 골자의 업무협약(MOU)을 체결했다고 16일 밝혔다. 카카오뱅크는 연내 애플리케이션(앱)에서 간편하게 개설 가능한 '키움증권 주식계좌개설 서비스'를 출시할 예정이며,https://n.news.naver.com/mnews/article/092/0002370829
"한국룬드벡, 브래드 애드워즈 CEO 선임",브래드 애드워즈 한국룬드벡 신임 CEO 한국룬드벡이 지난 1일 브래드 애드워즈(Brad Edwards) 최고경영자(CEO)를 선임했다. 한국 법인 설립 이후 23년 만에 첫 외국인 CEO다. 브래드 애드워즈 신임 대,https://n.news.naver.com/mnews/article/092/0002370828
"패스워드 없는 시대, 국내 플랫폼들은 `패스키`로 전환 중","올해 전반기, 국내 대표 포털서비스 기업인 네이버와 카카오가 '패스키(Passkey) 로그인' 기능을 도입하며 디지털 인증 기술의 전환이 본격화되고 있다. '패스키'는 기존 ID·비밀번호 체계 없이도 생체인식이나 물",https://n.news.naver.com/mnews/article/029/0002948478
"롯데리아, 롯리단길 4번째 디저트 ‘쥐포튀김’ 출시",롯데리아가 지역 상생 및 동반성장 목적의 ‘롯리단길 캠페인’을 통해 네 번째 협업 디저트 신메뉴 ‘쥐포튀김’을 오는 17일 출시한다고 16일 밝혔다. 롯리단길은 지역의 숨겨진 디저트 맛집을 발굴하고 전국 롯데리아 매,https://n.news.naver.com/mnews/article/092/0002370827
"네이버 세금 4000억 낼때, 구글은 200억만 ‘외산 빅테크 법인세 공백’","구글 법인세, 네이버의 5% 수준 국내 기업과 형평성 문제 지적도 지난해 구글 한국법인이 납부한 법인세가 240억원으로 나타나면서 빅테크의 세금 회피 논란이 다시 도마에 올랐다. 구글의 국내 연 매출은 네이버·카카오",https://n.news.naver.com/mnews/article/016/0002458095
"폴더블 아이폰, '안보이는 카메라' 첫 도입할 듯",스마트폰 화면 아래에 카메라를 보이지 않게 탑재하는 '언더디스플레이카메라(UDC)' 기술이 아이폰 최초로 폴더블 아이폰에 탑재될 것이라는 관측이 나왔다. 카메라를 화면 아래에 넣게 될 경우엔 아이폰 특유의 안면인식 ,https://n.news.naver.com/mnews/article/003/0013186707
"""KT만의 성장방식 찾겠다""… 콘텐츠 체질개선 'AX' 본격화",KT가 침체되는 콘텐츠 시장의 체질개선을 위해 AX(AI 전환)를 본격화할 계획이다. AI를 바탕으로 제작 과정을 혁신해 경쟁력을 확보하겠다는 복안이다. KT는 16일 안다즈 서울 강남 호텔에서 기자간담회 'KT그룹,https://n.news.naver.com/mnews/article/417/0001071250
"LIG넥스원·시큐리티플랫폼, 국방 AI·무인체계 보안기술 협력 협약 체결",최종진 LIG넥스원 미래전장사업부문장(오른쪽)과 황수익 시큐리티플랫폼 대표이사가 지난 15일 LIG넥스원 서울사무소에서 '국방 인공지능(AI) 및 무인체계 보안 기술 적용 협력을 업무협약'을 체결한 뒤 기념 촬영하고,https://n.news.naver.com/mnews/article/001/0015333173
"美 트럼프, 약가 인하 행정명령…K-바이오시밀러에 호재?",도널드 트럼프 미국 대통령이 15일(현지시각) 고가 의약품의 약가를 낮추기 위한 행정 명령을 내리면서 국내 바이오시밀러 기업들이 수혜를 입을 것이라는 전망이 제기되고 있다. 도널드 트럼프 미국 대통령 (사진=AP 연,https://n.news.naver.com/mnews/article/018/0005989134
"롯데칠성음료, 카리나와 함께한 크러시 신규 광고 공개","롯데칠성음료가 모델 카리나가 출연한 맥주 크러시 신규 광고를 공개한다고 16일 밝혔다. 이번 광고는 에스파의 카리나와 모델 재계약을 진행하고 새롭게 선보이는 광고로, '크게 터지는 탄산 러시' 콘셉트로 크러시의 탄산",https://n.news.naver.com/mnews/article/092/0002370824
"엔코아, 아이엔소프트와 `데이터웨어` 영업 파트너 협약","엔코아는 아이엔소프트와 자사 데이터 통합관리 솔루션 '데이터웨어'에 대한 영업 파트너 협약을 체결했다고 16일 밝혔다. 이번 협약으로 아이엔소프트는 '데이터웨어' 제품군에 대한 공식 판매권을 확보하고, 제품 교육과 ",https://n.news.naver.com/mnews/article/029/0002948474
"후지필름코리아, 유네스코 아태교육원과 MOU.. '국제이해교육 사진교실' 후원",후지필름일렉트로닉이미징코리아가 유네스코 아시아태평양 국제이해교육원과 업무협약을 맺고 청소년을 위한 세계시민교육 프로그램인 ‘국제이해교육 사진교실’을 정기 후원한다고 16일 밝혔다. 지난 15일 서울 구로구에 위치한 ,https://n.news.naver.com/mnews/article/014/0005336703
노태문 “미래 신사업 발굴·판매단 운영에 집중”,"삼성전자 디바이스경험(DX)부문장 직무대행을 겸하게 된 노태문 모바일경험(MX)사업부장 [삼성전자 제공] 삼성전자 디바이스경험(DX)부문장 직무대행을 겸하게 된 노태문 모바일경험(MX)사업부장이 미래 신사업 발굴, ",https://n.news.naver.com/mnews/article/016/0002458068
"게임문화재단·성남시, 9월 판교역 광장서 게임축제 개최","게임문화재단이 도심형 게임축제 'GXG 2025'를 9월19일부터 양일간 경기 성남시 판교역 광장 일대에서 개최한다고 16일 밝혔다. '게임, 문화로 즐기다!'라는 슬로건을 내건 이 행사는 게임의 문화예술적 확장성을",https://n.news.naver.com/mnews/article/003/0013186661
위로보틱스 “1인 1로봇 시대 연다…모든 사람에게 한층 진화한 보행 경험 제공할 것”,차세대 보행 보조 웨어러블 로봇 ‘윔S’ 공개 무게 1.6㎏·생체 역학 기반 안전 보행 지원 초기 모델 ‘윔’ 피드백 반영…보행 모드 추가 위로보틱스 관계자가 차세대 웨어러블 로봇 ‘윔S’를 착용한 모습 [위로보틱스,https://n.news.naver.com/mnews/article/016/0002458057
"토스뱅크, 연간 흑자 달성…영시니어·기업 고객군 확장나선다","토스뱅크가 2024년 첫 연간 흑자 달성을 발판삼아 동남아시아 등 글로벌 진출을 검토한다. 16일 서울 여의도 페어몬트호텔에서 열린 기자간담회에서 이은미 토스뱅크 대표는 ""인터넷은행의 속도와 파격이라는 장점에 은행이",https://n.news.naver.com/mnews/article/092/0002370821
"LG CNS, 금융 AI 전환(AX) 이끈다···잇달아 AI 플랫폼 구축",LG CNS가 국네 금융사에 잇달아 인공지능(AI) 플랫폼을 구축히며 AI 전환(AX)을 이끌고 있다. 16일 업계에 따르면 LG CNS는 최근 미래에셋증권이 추진한 'AI 네이티브 운영(AIOpS) 플랫폼' 구축 ,https://n.news.naver.com/mnews/article/030/0003303841
"[포토] 위로보틱스, 웨어러블 로봇 `윔 S` 출시",16일 용산구 그랜드 하얏트 서울에서 열린 위로보틱스의 보행 보조 웨어러블 로봇 '윔(WIM) S' 출시 행사에서 제품을 착용한 모델들이 포즈를 취하고 있다. WIM S(윔 에스)는 초경량·인체공학 설계와 AI 기반,https://n.news.naver.com/mnews/article/029/0002948464
모비스 상하이모터쇼 참가…올해 중국 수주 2억불 목표,현대모비스는 오는 23일 개막하는 ‘오토상하이 2025’(이하 상하이모터쇼)에 참가해 중국 고객들에 특화된 신기술을 대거 선보인다고 16일 밝혔다. 지난해 베이징모터쇼에 이어 중국 양대 모터쇼로 꼽히는 상하이모터쇼에,https://n.news.naver.com/mnews/article/082/0001321441
[인사]한국원자력안전기술원(KINS),●한국원자력안전기술원(KINS) ◇단·부장급 △방사선규제단장 유송재 △생활방사선규제단장 이지연 △경영관리단장 박진형. (2025년 4월 16일자),https://n.news.naver.com/mnews/article/018/0005989115
"유안타증권, ""헥토이노베이션, 절대적 저평가 구간""","유안타증권이 16일 NDR(기업·투자설명회) 후기 보고서를 통해 헥토이노베이션이 '절대적 저평가 구간'에 있다고 분석했다. 권명준 유안타증권 연구원은 ""헥토이노베이션의 최근 5년간(2020~2024년) 연결기준 매출",https://n.news.naver.com/mnews/article/008/0005181240
[포토] 보행보조 웨어러블 로봇 'WIM S' 출시,웨어러블 로봇 기업 위로보틱스가 초경량·인체공학 설계와 인공지능(AI) 기반 보행보조 기능을 통해 안정적이고 효율적인 이동을 보행보조 웨어러블 로봇 'WIM S'를 공식 출시했다. WIM S는 초경량 설계와 다양한 ,https://n.news.naver.com/mnews/article/030/0003303836
[포토] 보행보조 웨어러블 로봇 `윔(WIM) S`,16일 용산구 그랜드 하얏트 서울에서 열린 위로보틱스의 보행 보조 웨어러블 로봇 '윔(WIM) S' 출시 행사에서 제품을 착용한 모델들이 포즈를 취하고 있다. WIM S(윔 에스)는 초경량·인체공학 설계와 AI 기반,https://n.news.naver.com/mnews/article/029/0002948463
[포토]위로보틱스 보행보조 웨어러블 로봇 'WIM S' 출시,웨어러블 로봇 기업 위로보틱스가 초경량·인체공학 설계와 인공지능(AI) 기반 보행보조 기능을 통해 안정적이고 효율적인 이동을 보행보조 웨어러블 로봇 'WIM S'를 공식 출시했다. WIM S는 초경량 설계와 다양한 ,https://n.news.naver.com/mnews/article/030/0003303833
[포토] 위로보틱스 WIM S 출시,웨어러블 로봇 기업 위로보틱스가 초경량·인체공학 설계와 인공지능(AI) 기반 보행보조 기능을 통해 안정적이고 효율적인 이동을 보행보조 웨어러블 로봇 'WIM S'를 공식 출시했다. WIM S는 초경량 설계와 다양한 ,https://n.news.naver.com/mnews/article/030/0003303831
[포토]위로보틱스 보행보조 웨어러블 로봇 'WIM S' 출시,웨어러블 로봇 기업 위로보틱스가 초경량·인체공학 설계와 인공지능(AI) 기반 보행보조 기능을 통해 안정적이고 효율적인 이동을 보행보조 웨어러블 로봇 'WIM S'를 공식 출시했다. WIM S는 초경량 설계와 다양한 ,https://n.news.naver.com/mnews/article/030/0003303830
[포토] 보행보조 웨어러블 로봇 'WIM S' 출시,웨어러블 로봇 기업 위로보틱스가 초경량·인체공학 설계와 인공지능(AI) 기반 보행보조 기능을 통해 안정적이고 효율적인 이동을 보행보조 웨어러블 로봇 'WIM S'를 공식 출시했다. WIM S는 초경량 설계와 다양한 ,https://n.news.naver.com/mnews/article/030/0003303829
울프독 3마리와 쇼핑몰에…“입마개 의무 아니라지만” [e글e글],입마개를 채우지 않은 대형견들을 데리고 쇼핑몰을 다닌 여성 때문에 누리꾼들의 갑론을박이 이어졌다. 견주 A 씨는 지난 10일 자신의 인스타그램을 통해 “오랜만에 빵 사러 왔다”는 글과 함께 반려견 세 마리와 함께 유,https://n.news.naver.com/mnews/article/020/0003628696
"[포토] 위로보틱스, 보행 보조 웨어러블 로봇 `윔 S` 출시",16일 용산구 그랜드 하얏트 서울에서 열린 위로보틱스의 보행 보조 웨어러블 로봇 '윔(WIM) S' 출시 행사에서 제품을 착용한 모델들이 포즈를 취하고 있다. WIM S(윔 에스)는 초경량·인체공학 설계와 AI 기반,https://n.news.naver.com/mnews/article/029/0002948458
"中 샤오펑, 자율주행 칩 독자화 가속…2분기 양산 시작","중국 전기차 업체 샤오펑이 자체 개발한 자율주행 칩을 탑재한 신차를 조만간 선보인다. 15일(현지시간) 중국 매체 36Kr에 따르면 샤오펑은 자체 개발한 인공지능(AI) 반도 ‘튜링' 양산을 2분기부터 시작하며, 이",https://n.news.naver.com/mnews/article/092/0002370818
[포토] 건강한 일상 위한 웨어러블 로봇 WIM S 출시,16일 용산구 그랜드 하얏트 서울에서 열린 위로보틱스의 보행 보조 웨어러블 로봇 '윔(WIM) S' 출시 행사에서 제품을 착용한 모델들이 포즈를 취하고 있다. WIM S(윔 에스)는 초경량·인체공학 설계와 AI 기반,https://n.news.naver.com/mnews/article/029/0002948457
[포토] 보행 보조 웨어러블 로봇 윔(WIM) S,16일 용산구 그랜드 하얏트 서울에서 열린 위로보틱스의 보행 보조 웨어러블 로봇 '윔(WIM) S' 출시 행사에서 제품을 착용한 모델들이 포즈를 취하고 있다. WIM S(윔 에스)는 초경량·인체공학 설계와 AI 기반,https://n.news.naver.com/mnews/article/029/0002948456
"한국전파진흥협회-HL만도&HL클레무브-현대엔지비, 모빌리티 SW 인력양성 위한 Intelligent Vehicle School 4기 교육생 모집","한국전파진흥협회(RAPA)는 임베디드&자율주행 기반 지능형 차량 SW 전문인력 양성을 위한 Intelligent Vehicle School 4기 클래스메이트를 모집한다. 한국전파진흥협회(RAPA)와 HL만도, HL클",https://n.news.naver.com/mnews/article/144/0001033068
"대구시, 지역 특화 제조AI센터 유치 총력…'기계요소·소재부품산업 인프라+AI'로 지역 제조경쟁력 강화할 것",스마트공장 공급기업이 수도권을 제외한 지역 중 가장 많이 분포돼 있는 대구시가 제조산업 디지털 전환(AX)으로 지역 기업 경쟁력을 강화하기 위해 '지역 특화 제조AI센터 구축사업' 유치에 총력을 쏟는다. 대구시와 대,https://n.news.naver.com/mnews/article/030/0003303823
"S2W, 이노션 ‘AI 얼라이언스’ 참여",S2W는 이노션과 ‘AI 얼라이언스’ 양해각서(MOU)를 체결하고 기업 고객의 비즈니스 생산성을 강화하기 위한 AI 전환(AX) 가속화에 협력한다고 16일 밝혔다. 작년 10월에 이어 두 번째로 결성된 본 얼라이언스,https://n.news.naver.com/mnews/article/014/0005336683
"오핌디지털, 독자적 AI기술로 개발한 G-VFX 플랫폼으로  글로벌 미디어 콘텐츠 시장 혁신 주도","VFX 영상 전문기업 오핌디지털(대표 윤성민)은 AI 알고리즘과 빅데이터 분석 기술을 접목하여 복잡한 영상 시각효과 작업의 자동화 및 최적화를 실현, 4배 이상의 제작 효율성을 보이는 ‘G-VFX’ 플랫폼을 자체 개",https://n.news.naver.com/mnews/article/117/0003933225
"LG유플러스, 시각장애인 지팡이로 버스 승하차 돕는 기술 실증",LG유플러스는 시각장애인이 안전하게 대중교통을 이용하도록 돕는 특화 단말 실증사업을 성공적으로 마쳤다고 16일 밝혔다. 이번 사업은 현대자동차·기아의 ‘2023 아이디어페스티벌’에서 대상을 수상한 ‘시각장애인 이동접,https://n.news.naver.com/mnews/article/144/0001033065
"현대백화점, 싱가포르 ‘마리나베이샌즈’와 맞손…VIP 고객 경험 차별화",현대백화점이 싱가포르의 대표 랜드마크인 ‘마리나 베이 샌즈(Marina Bay Sands)’와 상호 VIP 고객 방문 시 자사 서비스를 제공하는 데 협의했다. 이로써 현대백화점은 VIP 고객들에게 태국과 일본에 이어,https://n.news.naver.com/mnews/article/092/0002370817
“생산속도 무려 4배↑” 사탕수수 찌꺼기+햇빛…그린 수소 만든다,"- UNIST, 태양광 수소 생산 기술 개발 태양광만을 이용한 고효율 이중 수소 생산 시스템 모식도.[UNIST 제공] 국내 연구진이 사탕수수 찌꺼기와 햇빛으로 그린 수소를 생산하는 기술이 개발됐다. 울산과학기술원(",https://n.news.naver.com/mnews/article/016/0002458032
"구글, '제미나이'에 '비오2' 통합…판 커지는 'AI 모델' 경쟁",구글이 지난해 말 공개한 영상 생성 인공지능(AI) 모델 ‘비오 2’를 정식 출시했다. 별도 앱이 아닌 자사 주력 모델인 ‘제미나이’에 통합하는 방식으로 빅테크의 AI 통합 움직임을 따랐다. 15일(현지시간) 구글은,https://n.news.naver.com/mnews/article/015/0005119895
"LG전자, 항균 신소재 'LG 퓨로텍' 글로벌 확장",LG전자가 기업간거래(B2B) 사업으로 육성하는 유리파우더 신소재 'LG 퓨로텍' 글로벌 고객 확대에 속도를 낸다. LG전자는 중국 광둥성 선전에서 개막한 아시아 최대 규모 산업소재 전시회 '차이나플라스 2025'에,https://n.news.naver.com/mnews/article/030/0003303818
"게임문화재단, 판교역 광장에서 도심형 게임축제 연다","게임문화재단이 도심형 게임축제 'GXG 2025'를 올해 9월 개최한다고 16일 밝혔다. 올해로 3회째 열리는 GXG 2025는 성남시가 주최하고 성남산업진흥원과 게임문화재단이 주관한다. 행사는 9월 19, 20일 ",https://n.news.naver.com/mnews/article/421/0008195676
"세븐일레븐, 모바일앱 리뉴얼 한 달…2030 가입자 60% ↑","편의점 세븐일레븐이 모바일 앱(이하 세븐앱) 재단장 이후 가입자 수가 늘어나는 등 긍정적인 효과가 나타나고 있다고 16일 밝혔다. 이번 리뉴얼의 핵심은 손쉬운 기능과 간편한 메뉴 접근성, 그리고 이용 속도의 향상이다",https://n.news.naver.com/mnews/article/092/0002370815
1분기 세계 PC 출하량 5900만대...전년비 4.8% ↑,시장조사업체 가트너는 올해 1분기에 글로벌 PC 출하량이 전년 동기 대비 4.8% 증가한 5900만대를 기록했다고 16일 밝혔다. 업체별 출하량 순위는 △레노버 1527만5000대(시장점유율 25.9%) △HP 12,https://n.news.naver.com/mnews/article/031/0000924962
"SKT, 경찰청과 협력해 4개월간 악성앱 2610건 차단","SKT는 경찰청과의 협력을 통해 지난해 12월부터 올 3월까지 총 2610건의 악성앱을 발견, 차단 조치해 약 1070억 원의 피해를 예방했다고 16일 밝혔다. 이번 악성앱 차단 협력은 크게 두가지 방향으로 진행됐다",https://n.news.naver.com/mnews/article/144/0001033057
"펄핏, 넬슨스포츠에 암벽화 추천 솔루션 공급",AI 핏테크 스타트업 펄핏(대표 이선용)이 아웃도어 전문 브랜드 넬슨스포츠에 암벽화 추천 솔루션을 제공한다고 16일 밝혔다. 펄핏이 넬슨스포츠에 공급하는 암벽화 추천 솔루션은 누적 250만건 이상의 고객 발 모양 분,https://n.news.naver.com/mnews/article/092/0002370813
"삼성전기, 中 BYD에 전장용 MLCC 공급…사업 진출 후 첫 대규모 납품 [소부장반차장]","삼성전기가 세계 최대 전기차 기업인 중국 BYD(비야디)에 자동차용 적층세라믹커패시터(MLCC)를 대규모로 공급한다. 전장용 MLCC 사업 확장을 선언한 이후, 사실상 첫 성과로 평가되며 이재용 삼성전자 회장의 최근",https://n.news.naver.com/mnews/article/138/0002194746
"LIG넥스원·시큐리티플랫폼 ""국방 AI·무인체계 보안기술 협력""","LIG넥스원은 지난 15일 서울사무소에서 보안 전문기업 시큐리티플랫폼과 '국방 인공지능(AI) 및 무인체계 보안 기술 적용 협력을 업무협약(MOU)'을 체결했다고 16일 밝혔다. 양사는 MOU에서 무인 수상정, 항공",https://n.news.naver.com/mnews/article/001/0015333056
"위밋모빌리티, 월드IT쇼 2025 참가… AI 배차 솔루션 `루티` 전면 소개",AI 기반 물류 최적화 솔루션 '루티(ROOUTY)'를 운영하는 위밋모빌리티가 오는 24일부터 26일까지 서울 코엑스에서 열리는 '2025 월드IT쇼(WIS 2025)'에 참가한다고 16일 밝혔다. 이번 전시를 통해,https://n.news.naver.com/mnews/article/029/0002948448
"커머스 AX 전환 기업 인덴트, AI 리뷰 솔루션 전면 개편",커머스 AI 전환(AX) 전문 기업 인덴트코퍼레이션이 자사의 AI 리뷰 수집 솔루션 '브이리뷰'의 구독 정책과 서비스 제공 범위를 전면 개편한다고 16일 밝혔다. 인덴트 측은 이번 개편으로 AI 기술 발전에 따른 기,https://n.news.naver.com/mnews/article/014/0005336664
이제 쏘카 앱에서도 서울시 자전거 '따릉이' 탄다,모빌리티 플랫폼 쏘카가 서울시와 협력해 공공자전거 따릉이를 쏘카 앱에서 이용할 수 있도록 서비스를 연계한다고 16일 밝혔다. 이번 서비스 연계를 통해 서울시에서 운영 중인 4만 5000여대의 따릉이와 전국에서 운영중,https://n.news.naver.com/mnews/article/014/0005336662
"에이직랜드, 광주 사무소 개소…반도체 산업 활성화 협력",에이직랜드는 광주광역시 광주실감콘텐츠큐브(GCC)에 광주사무소를 개소했다고 16일 밝혔다. 광주시와 협약을 맺은 반도체 팹리스 기업 최초로 사무소를 개소했다. 에이직랜드는 광주사무소를 통해 △지역대학과 반도체 전문인,https://n.news.naver.com/mnews/article/030/0003303810
"KISDI, '온라인 광고 시장의 경매 경쟁에 대한 연구' 보고서 발간",정보통신정책연구원(KISDI)은 KISDI 기본연구 ‘온라인 광고 시장의 경매 경쟁에 대한 연구’ 보고서를 발간했다고 16일 밝혔다. 해당 보고서는 온라인 검색 광고 서비스가 사회적 편익에 미치는 영향을 분석하고 광,https://n.news.naver.com/mnews/article/014/0005336661
"'우리 강아지 사람으로 바꿔줘'…챗GPT, 또 대박 터졌다","반려동물을 사람처럼 바꾸는 인공지능(AI) 이미지 생성이 새로운 유행으로 떠오르고 있다. 지브리·디즈니 스타일을 넘어, 최근엔 '동물의 인간화'가 SNS에서 큰 인기를 끌고 있다. 15일(현지시간)일 뉴욕포스트에 따",https://n.news.naver.com/mnews/article/015/0005119889
"GS25, 홍대입구에 FC서울 특화 매장 열어…""스포츠 팬덤 성지로""",GS리테일이 운영하는 편의점 GS25가 GS스포츠와 손잡고 프로축구단 FC서울을 테마로 한 스포츠 특화 편의점(이하 특화 매장)을 선보인다고 16일 밝혔다. GS25는 마포구 홍대입구역 인근의 GS25 연남한양점을 ,https://n.news.naver.com/mnews/article/092/0002370812
[포토]위로보틱스 로봇 WIM S 입고 오르막길도 가뿐하게,위로보틱스가 16일 서울 용산구 한남동 그랜드 하얏트서울에서 보행보조 웨어러블 로봇 WIM S(윔 에스)를 선보이고 있다. 위로보틱스 WIM S(윔 에스)는 초경량·인체공학 설계와 AI 기능을 통해 안정적이고 효율적,https://n.news.naver.com/mnews/article/018/0005989069
[포토]보행보조 웨어러블 로봇 '윔 에스',위로보틱스가 16일 서울 용산구 한남동 그랜드 하얏트서울에서 보행보조 웨어러블 로봇 WIM S(윔 에스)를 선보이고 있다. 위로보틱스 WIM S(윔 에스)는 초경량·인체공학 설계와 AI 기능을 통해 안정적이고 효율적,https://n.news.naver.com/mnews/article/018/0005989068
"[포토]1인 1로봇 시대, 보행보조 웨어러블 로봇 출시",위로보틱스가 16일 서울 용산구 한남동 그랜드 하얏트서울에서 보행보조 웨어러블 로봇 WIM S(윔 에스)를 선보이고 있다. 위로보틱스 WIM S(윔 에스)는 초경량·인체공학 설계와 AI 기능을 통해 안정적이고 효율적,https://n.news.naver.com/mnews/article/018/0005989067
"LS에코에너지, 필리핀 태양광발전단지에 케이블 공급",LS에코에너지는 베트남 생산법인 LS비나가 필리핀 대규모 태양광 발전단지에 전력 케이블을 공급했다고 16일 밝혔다. 필리핀 주요 발전사들이 루손섬 서부 잠발레스주에 공동 추진 중인 346㎿급 태양광 발전단지다. 루손,https://n.news.naver.com/mnews/article/030/0003303809
