기사 제목,내용,링크
"도심형 게임축제 GXG 2025, 9월 19~20일 개최 확정",게임문화재단은 성남시가 주최하고 성남산업진흥원과 게임문화재단이 공동 주관하는 도심형 게임문화축제 GXG 2025가 오는 9월 19일부터 20일까지 양일간 판교역 광장 일대에서 열린다고 16일 밝혔다. 올해로 3회째를,https://n.news.naver.com/mnews/article/092/0002370875
"“경쟁보단 협동이 좋아” 마비노기 모바일, MMORPG 새 방향성 제시했다",넥슨 신작 ‘마비노기 모바일’이 세대와 성별을 아우르는 폭넓은 이용자층의 호응을 바탕으로 모바일 다중접속역할수행게임(MMORPG) 시장에 새로운 흐름을 만들어가고 있다. 경쟁 부담감을 줄인 차별화된 콘텐츠가 주효했다,https://n.news.naver.com/mnews/article/138/0002194775
"'발할라 서바이벌', 보스 2종 공략하는 길드 토벌 추가","라이온하트스튜디오는 모바일 액션 게임 '발할라 서바이벌'에 길드 콘텐츠 길드 토벌을 추가했다. 먼저, 길드 토벌은 정해진 기간 동안 단계별로 등장하는 보스 2종을 처치하고, 토벌 단계와 피해를 준 보스 누적 총 피해량을 기준으로 순위를 산정하는 방식의 콘텐츠다. 토벌을 통해 획득한 재화는 아이템으로 교환할...",https://n.news.naver.com/mnews/article/236/0000248458
"‘컴투스프로야구2025’, 출시 10주년 맞아 에픽카드 꾸러미 쏜다",원하는 구단 에픽 선수 카드 획득 가능 최대 ‘등급 상승권’ 지급 이벤트 시작 컴투스가 대한민국 레전드 모바일 야구 게임 ‘컴투스프로야구2025’의 출시 10주년을 맞아 원하는 구단의 에픽 선수 카드를 얻을 수 있는,https://n.news.naver.com/mnews/article/009/0005477341
"컴투스홀딩스 스피릿 테일즈, 네이버웹툰 '호랑이형님' 컬래버레이션",컴투스홀딩스(대표 정철호)는 16일 캐주얼 MMORPG ‘스피릿 테일즈’가 네이버웹툰 ‘호랑이형님’과의 컬래버레이션을 진행한다고 밝혔다. 네이버웹툰의 대표작으로 꼽히는 호랑이형님은 신비한 힘을 지닌 아이를 둘러싼 반,https://n.news.naver.com/mnews/article/092/0002370862
"게임이용자협회, ‘게임 이용자 공약 제안서’ 주요 정당에 전달",한국게임이용자협회가 강유정 더불어민주당 게임특별위원회 위원장(오른쪽)에게 ‘이용자 정책 제안서’를 전달하고 있다. 한국게임이용자협회 제공 한국게임이용자협회는 지난 14~15일에 걸쳐 협회 구성원들의 의견을 취합해 작,https://n.news.naver.com/mnews/article/396/0000706432
"젭, ‘부산교육연구정보원’과 젭 퀴즈 프로 플랜 공급 계약 체결","메타버스 기반 에듀테크 플랫폼 '젭(ZEP, 대표 김원배, 김상엽)'이 ‘부산교육연구정보원’과 계약을 체결하고 부산 지역 내 100개 학교에 '젭 퀴즈(ZEP QUIZ) 프로 플랜'을 제공한다고 16일 밝혔다. 이번",https://n.news.naver.com/mnews/article/092/0002370860
"코그, '리턴 얼라이브' 글로벌 직접 서비스 실시",KOG(대표 이종원)는 16일 탑다운 전략 슈팅 게임 ‘리턴 얼라이브(Return Alive)’를 글로벌 게임 서비스 플랫폼 ‘KOG Games’를 통해 직접 서비스한다고 밝혔다. KOG는 이번 직접 서비스를 통해 ,https://n.news.naver.com/mnews/article/092/0002370857
"'레전드 오브 슬라임' 꺾이자…로드컴플릿, 매출 1000억 증발",모바일 게임 '레전드 오브 슬라임'으로 글로벌 흥행 신화를 쓴 로드컴플릿이 1년만에 매출이 1000억원 이상 감소하며 급격한 하향 곡선을 그리고 있다. 16일 로드컴플릿 감사보고서에 따르면 2024년 연결 기준 영업,https://n.news.naver.com/mnews/article/030/0003303962
"도심형 게임축제 ‘GXG 2025’, 판교서 9월 개최",'GXG 2025'가 9월 개최한다. 게임문화재단 제공 도심형 게임축제 ‘GXG 2025’가 작년보다 확장된 규모로 찾아온다. 게임문화재단에 따르면 GXG 2025(게임 컬처 X 제너레이션 2025)는 오는 9월19,https://n.news.naver.com/mnews/article/396/0000706431
"라인게임즈, 퍼즐 게임 '헬로키티 프렌즈 매치' 사전예약 진행",라인게임즈는 개발 관계사 슈퍼어썸이 개발하는 신작 모바일 매치3 퍼즐 게임 ‘헬로키티 프렌즈 매치’의 소프트론칭을 실시하고 사전예약을 진행한다고 16일 밝혔다. ‘헬로키티 프렌즈 매치’는 올해 라인게임즈가 선보이는 ,https://n.news.naver.com/mnews/article/003/0013187207
"위메이드커넥트, '프리프 유니버스' 24일 국내 서비스 시작",위메이드맥스의 자회사 위메이드커넥트가 글로벌 MMORPG(다중접속역할수행게임) ‘프리프 유니버스(Flyff Universe)’의 한국 정식 서비스를 오는 24일 시작한다고 밝혔다. 2022년 해외 시장에 먼저 선보인,https://n.news.naver.com/mnews/article/003/0013187199
"저니 오브 모나크, 독립 서버 하이네 오픈","엔씨소프트는 방치형 MMORPG '저니 오브 모나크'에 하이네 서버를 추가했다. 하이네 서버는 기존 서버들과 분리된 독립 서버다. 병영과 결투장 콘텐츠 등의 매칭이 해당 서버 내에서만 이루어진다. 신규 이용자는 모두 하이네 서버로만 진입 가능하며, 기존 이용자는 하이네 서버 접속이 제한된다.이와 함께 게임...",https://n.news.naver.com/mnews/article/236/0000248457
"라인게임즈, 매치3 퍼즐 '헬로키티 프렌즈 매치' 소프트론칭",라인게임즈는 개발 관계사 슈퍼어썸이 개발하고 자사가 서비스 예정인 신작 모바일 매치3 퍼즐 타이틀 '헬로키티 프렌즈 매치' 글로벌 소프트론칭을 실시하고 사전예약을 진행한다. 헬로키티 프렌즈 매치는 올해 라인게임즈가 ,https://n.news.naver.com/mnews/article/030/0003303930
"위메이드커넥트, '프리프 유니버스' 24일 국내 출시",위메이드맥스 자회사 위메이드커넥트는 글로벌 다중접속역할수행게임(MMORPG) '프리프 유니버스' 한국 정식 서비스를 24일 시작한다. 2022년 해외 시장에 먼저 선보인 프리프 유니버스는 원작 '프리프 온라인'을 기,https://n.news.naver.com/mnews/article/030/0003303927
"넥슨, PvPvE 서바이벌 신작 '아크 레이더스' 2차 테크니컬 테스트 개시",넥슨은 자회사 엠바크 스튜디오에서 개발 중인 PvPvE 서바이벌 액션 신작 '아크 레이더스'의 두 번째 테크니컬 테스트를 30일부터 개시한다. 아크 레이더스는 콘솔·PC 패키지로 개발 중인 익스트랙션 기반 게임이다.,https://n.news.naver.com/mnews/article/030/0003303921
"플레이위드코리아 '로한2', 2분기 업데이트 로드맵 공개...서버 이전에 신규 지역 추가","플레이위드코리아(대표 김학준)는 플레이위드게임즈가 개발한 MMORPG ‘로한2’의 서버 이전 시스템, 신규 지역 공개, 레벨 제한 장비 등을 포함해 다양한 콘텐츠 업데이트를 예고했다고 16일 밝혔다.. 회사 측에 따",https://n.news.naver.com/mnews/article/092/0002370847
풀뿌리 이스포츠의 중심 '2025 이스포츠 동호인 대회' 시동,한국e스포츠협회는 전국 40개 e스포츠 시설 운영자를 대상으로 '2025 e스포츠 동호인 대회' 사업설명회를 개최했다고 16일 밝혔다. 설명회에는 전국 40개 e스포츠 시설 운영자 16명이 참석했다. 2025년 e스,https://n.news.naver.com/mnews/article/030/0003303920
"게임이용자협회, 국회 주요 정당에 '게임 이용자 정책 제안서' 전달","한국게임이용자협회는 더불어민주당, 국민의힘, 개혁신당, 진보당 등 주요 정당에 게임 이용자 정책 제안서를 전달했다고 16일 밝혔다. 협회는 국회를 방문해 강유정 더불어민주당 의원, 김승수 국민의힘 의원, 천하람 개혁",https://n.news.naver.com/mnews/article/030/0003303918
"라인게임즈, 매치3 퍼즐 '헬로키티 프렌즈 매치' 소프트론칭","라인게임즈(공동대표 박성민, 조동현)는 개발 관계사 슈퍼어썸(대표 조동현)이 개발하고 있는 신작 모바일 매치3 퍼즐 타이틀 ‘헬로키티 프렌즈 매치(Hello Kitty Friends Match)’ 그랜드 론칭에 앞서",https://n.news.naver.com/mnews/article/092/0002370843
"'게임, 문화로 즐기다' GXG 2025, 9월 판교서 개최","게임문화재단은 도심형 게임 축제 'GXG 2025'를 오는 9월 19일부터 20일까지 경기 성남시 판교역 광장 일대에서 개최한다. 성남시가 주최하고 성남산업진흥원, 게임문화재단이 주관하는 GXG(Game cultur",https://n.news.naver.com/mnews/article/030/0003303907
"게임문화축제 'GXG 2025', 9월19일 판교서 개막",'GXG 2025' 로고(제공=게임문화재단). 게임문화재단은 오는 9월19일부터 20일까지 양일간 'GXG 2025(Game culture X Generation 2025)'를 판교역 광장 일대에서 개최한다고 16일 밝혔다. 'GXG 2025'는 성남시(시장 신상진)가 주최하고 성남산업진흥원(원장 이의준)과 게임문화재단(...,https://n.news.naver.com/mnews/article/347/0000185994
방치형 모바일 RPG '땜빵 해적단 키우기' 출시,"게임피아는 방치형 모바일 RPG '땜빵 해적단 키우기 : 방치형 RPG'를 구글플레이, 앱스토어, 원스토어에 출시했다.'땜빵 해적단 키우기 : 방치형 RPG'는 귀여운 땜빵머리 해적 주인공과 동료들이 펼치는 유쾌한 모험을 그린 코믹 게임이다. 게이머는 배가 침몰한 후 다시 잡혀가지 않기 위해...",https://n.news.naver.com/mnews/article/236/0000248456
"매치3 퍼즐 게임 '헬로키티 프렌즈 매치', 필리핀과 캐나다에 소프트론칭","라인게임즈는 개발 관계사 슈퍼어썸이 개발한 모바일 매치3 퍼즐 타이틀 '헬로키티 프렌즈 매치'를 필리핀과 캐나다에 소프트론칭을 실시하고, 사전예약을 진행한다.이 회사는 필리핀과 캐나다 지역을 대상으로 '헬로키티 프렌즈 매치' 소프트론칭을 진행하는 한편 타 국가에 대한 사전예약을 거쳐 올해 상반...",https://n.news.naver.com/mnews/article/236/0000248455
"'검은사막', 고난도 금돼지왕 우두머리 등장",펄어비스는 MMORPG '검은사막'에 금돼지왕 우두머리 신규 난도 팔/구/십재시니를 16일 추가했다.금돼지왕은 게임 내 아침의 나라와 함께 선보인 우두머리 도전 콘텐츠 검은사당에서 등장한다. 게이머는 검은사당 : 동해도편에서 강력해진 우두머리 금돼지왕과 1대1로 실력을 겨뤄볼 수 있다. 팔재시니는 공격력 3...,https://n.news.naver.com/mnews/article/236/0000248454
[콘텐츠 핫&뉴] ‘컴프야 2025’ 출시 10주년 특별 이벤트,컴투스(대표 남재관)가 ‘컴투스프로야구2025’(이하 컴프야2025)의 출시 10주년을 맞이해 특별 이벤트를 실시한다. 모바일 야구 게임 ‘컴프야2025’는 지난 2015년 4월 16일 3D 버전 출시 이후 올해 1,https://n.news.naver.com/mnews/article/009/0005477274
넥슨 '퍼스트 버서커: 카잔' 글로벌 순항…인기 비결 세 가지는?,넥슨의 신작 '퍼스트 버서커: 카잔'이 순항하고 있다. 지난달 25일 얼리 액세스 실시 후 스팀에서 95%의 긍정 리뷰를 통해 '압도적으로 긍정적' 평가를 받은 데 이어 정식 출시 후에는 글로벌 인기 게임 최고 2위,https://n.news.naver.com/mnews/article/031/0000924998
"위메이드커넥트, '프리프 유니버스' 4월 24일 韓 서비스","위메이드맥스(각자대표 손면석, 이길형)의 자회사 위메이드커넥트(대표 이호대)는 글로벌 MMORPG ‘프리프 유니버스(Flyff Universe)’의 한국 정식 서비스를 24일 시작한다고 밝혔다. 2022년 해외 시장",https://n.news.naver.com/mnews/article/092/0002370835
"[차트-모바일]""롱런 이어가는 '마비노기 모바일' 차트 상위권 유지""",■ 아이폰 게임 순위이번 주 아이폰 무료 게임 순위에서는 넥슨의 MMORPG '마비노기 모바일'이 꾸준한 인기에 힘입어 5위 자리를 지켰다.현재 롱런을 이어가고 있는 '마비노기 모바일'은 경쟁을 유도하는 기존 MMORPG와 달리 나만의 템포에 맞춰 판타지 라이프를 즐길 수 있는 콘테츠로 인기를...,https://n.news.naver.com/mnews/article/236/0000248453
"라인게임즈, `헬로키티 프렌즈 매치` 필리핀·캐나다에 소프트 론칭",상반기 중 국내 포함 글로벌 서비스 시작 라인게임즈는 신작 모바일 퍼즐 게임 '헬로키티 프렌즈 매치'를 필리핀과 캐나다에 소프트 론칭하고 사전예약을 실시한다고 16일 밝혔다. '헬로키티 프렌즈 매치'는 라인게임즈의 ,https://n.news.naver.com/mnews/article/029/0002948500
"TL, 1인 던전 ‘카일로스의 환상회랑’에 보스와 맵 추가","엔씨소프트는 MMORPG '쓰론 앤 리버티(이하 TL)'의 TL은 1인 던전 카일로스의 환상회랑에 보스와 맵을 추가했다.이번 업데이트에 따라 게이머는 오는 22일까지 재앙의 거목 전사: 베렌스, 붉은 달의 살수: 마르타 공략에 도전할 수 있다. 일반, 도전, 극한 등 3단계의 난도로 구성돼 보스 몬스터의 패...",https://n.news.naver.com/mnews/article/236/0000248452
모바일 배구 게임 '더 스파이크 크로스' 1억 다운로드 돌파,"선시안은 모바일 배구 게임 '더 스파이크 크로스'의 누적 다운로드 수가 최근 1억 건을 돌파했다고 16일 밝혔다.최근 글로벌 1억 다운로드를 기록한 '더 스파이크 크로스'는 3대 3 스타일의 배구 경기 룰을 기반으로, 역동적이고 속도감 있게 전개되는 흐름 속에 각 포지션의 장점을 살려, 상대편...",https://n.news.naver.com/mnews/article/236/0000248451
"출시 10주년 맞은 '컴투스프로야구2025', 기념 이벤트 실시",컴투스는 모바일 야구 게임 '컴투스프로야구2025(이하 컴프야2025)'의 출시 10주년을 맞아 이벤트를 실시한다.'컴프야2025'는 지난 2015년 4월 16일 3D 버전 출시 이후 올해 10번째 생일을 맞이했다. 올 시즌에는 각 구단을 대표해 뛰어난 활약을 펼친 선수들로 구성된 에픽 선수...,https://n.news.naver.com/mnews/article/236/0000248450
"도심형 게임축제 GXG 2025, 오는 9월 개최","성남시가 주최하고 성남산업진흥원과 게임문화재단이 주관하는 GXG 2025(Game culture X Generation 2025)가 오는 9월 19일부터 9월 20일 까지 양일간 개최된다. '게임, 문화로 즐기다!'라는 슬로건 아래 3회차를 맞이한 GXG 2025는 작년보다 확장된 판교역 광장 일대에서 열릴...",https://n.news.naver.com/mnews/article/236/0000248449
"'복싱스타 X', 초월 장비 얻는 한계 돌파 시스템 업데이트",디랩스게임즈는 라인·텔레그램 등 소셜 미디어 기반 웹3(블록체인) 게임 '복싱스타 X'에 게임 내 최고 등급인 초월 장비를 포함한 업데이트를 진행했다.이번 업데이트를 통해 기존 전설 장비(35레벨)를 한층 상위 개념으로 확장하는 한계 돌파 시스템을 선보였다. 이를 통해 게이머는 전설 장비를 초월...,https://n.news.naver.com/mnews/article/236/0000248448
"'로한2', 2분기 콘텐츠 로드맵 공개","플레이위드코리아는 MMORPG '로한2'의 공식 개시판을 통해 2분기 콘텐츠 로드맵을 공개했다.우선, 오는 6월까지 순차적으로 서버 이전 기능, 리옴 지역, 120 레벨 제한 장비, 콘텐츠 편의성 강화, 암흑도약을 선보일 예정이다.오는 23일 진행 예정인 서버 이전 시스템은 서버 내 모든 정보를 다른 서버로...",https://n.news.naver.com/mnews/article/236/0000248447
"넷마블, ‘쿵야 레스토랑즈’ 카카오 이모티콘 7탄 출시",넷마블(대표 김병규)은 콘텐츠 마케팅 자회사 엠엔비(대표 배민호)가 ‘쿵야 레스토랑즈’ 카카오 이모티콘 7탄 ‘이거 완전 럭키쿵야잖아’를 출시했다고 16일 밝혔다. 7번째로 선보이는 이번 이모티콘은 반복되는 일상에서,https://n.news.naver.com/mnews/article/009/0005477249
"넥슨 신작 `아크 레이더스`, 2차 테크니컬 테스트 30일 개시",내달 4일까지 PC·콘솔서 진행...성장 시스템·배틀패스 선봬 넥슨은 자회사 엠바크스튜디오가 개발 중인 신작 '아크 레이더스'의 2차 테크니컬 테스트를 오는 30일 개시한다고 밝혔다. '아크 레이더스'는 기계 생명체,https://n.news.naver.com/mnews/article/029/0002948491
"넥슨, PvPvE 서바이벌 신작 '아크 레이더스' 4월 30일 2차 테크니컬 테스트",넥슨코리아(공동 대표 강대현∙김정욱)는 자회사 엠바크 스튜디오(대표 패트릭 쇠더룬드)에서 개발 중인 PvPvE 서바이벌 액션 신작 ‘아크 레이더스(ARC Raiders)’의 두 번째 테크니컬 테스트를 4월,https://n.news.naver.com/mnews/article/092/0002370833
"게임이용자협회, 국회 찾아 '대선 게임 공약' 제안","한국게임이용자협회가 더불어민주당, 국민의힘, 개혁신당, 진보당 등 주요 정당에 게임 이용자 정책 제안서를 전달했다고 16일 밝혔다. 협회는 이달 14일과 15일 국회를 찾아 강유정 더불어민주당 의원, 김승수 국민의힘",https://n.news.naver.com/mnews/article/421/0008195870
"넥슨, PvPvE 서바이벌 신작 '아크 레이더스' 30일 2차 테크니컬 테스트",넥슨(공동 대표 강대현∙김정욱)은 자회사 엠바크 스튜디오(대표 패트릭 쇠더룬드)에서 개발 중인 PvPvE 서바이벌 신작 '아크 레이더스'의 두 번째 테크니컬 테스트를 4월 30일부터 개시한다고 16일 밝혔,https://n.news.naver.com/mnews/article/031/0000924978
"선시안, '더 스파이크 크로스' 글로벌 1억 다운로드 달성",선시안(대표 권오준)은 2D 모바일 배구 스포츠 게임 '더 스파이크 크로스'의 누적 다운로드 1억건을 돌파했다고 16일 밝혔다. 더 스파이크 크로스는 3대3 스타일의 배구 경기 룰을 기반으로 하는 스포츠 게임이다. ,https://n.news.naver.com/mnews/article/031/0000924975
"라인게임즈, 매치3 퍼즐 '헬로키티 프렌즈 매치' 소프트론칭","라인게임즈(공동대표 박성민, 조동현)는 관계사 슈퍼어썸(대표 조동현)이 개발한 신작 모바일 매치3 퍼즐 게임 '헬로키티 프렌즈 매치'의 소프트론칭을 실시하고 사전예약을 진행한다고 16일 밝혔다. 헬로키티 프렌즈 매치",https://n.news.naver.com/mnews/article/031/0000924971
"게임문화재단·성남시, 9월 판교역 광장서 게임축제 개최","게임문화재단이 도심형 게임축제 'GXG 2025'를 9월19일부터 양일간 경기 성남시 판교역 광장 일대에서 개최한다고 16일 밝혔다. '게임, 문화로 즐기다!'라는 슬로건을 내건 이 행사는 게임의 문화예술적 확장성을",https://n.news.naver.com/mnews/article/003/0013186661
"플레이위드, ‘로한2’ 서버 이전 시스템 등 콘텐츠 업데이트","플레이위드코리아(대표 김학준)는 MMORPG ’로한2‘의 서버 이전 시스템, 신규 지역 공개, 레벨 제한 장비 등을 포함해 다양한 콘텐츠 업데이트를 예고했다. 오는 6월까지 순차적으로 서버 이전 기능, 신규 지역 ‘",https://n.news.naver.com/mnews/article/009/0005477187
MMORPG 장르 인기 지속...넷마블·넥슨 신작 흥행 '성공',"모바일 MMORPG 장르의 인기가 식지 않고 지속되고 있는 것으로 확인됐다. 해당 장르는 엔씨소프트와 넥슨, 넷마블, 위메이드, 카카오게임즈 등이 주도하고 있다는 평가다. 이런 가운데 주요 게임사는 올해 신작 MMO",https://n.news.naver.com/mnews/article/092/0002370819
"위메이드커넥트, '프리프 유니버스' 글로벌 흥행 타고 한국 상륙",㈜위메이드맥스의 자회사 위메이드커넥트는 글로벌 MMORPG ‘프리프 유니버스’의 한국 정식 서비스를 24일 시작한다고 16일 밝혔다. 2022년 해외 시장에 먼저 선보인 ‘프리프 유니버스’는 원작 ‘프리프 온라인’을,https://n.news.naver.com/mnews/article/018/0005989111
"[LCK 정규 시즌] 젠지, OK저축은행 패배 설욕할까?","LCK 정규 시즌 들어 한 번도 패배하지 않은 젠지가 지난 LCK컵에서 OK저축은행 브리온에게 당한 패배를 설욕할 수 있을지 관심이 모아지고 있다. 리그 오브 레전드 챔피언스 코리아(대표 오상헌, 이하 LCK)는 1",https://n.news.naver.com/mnews/article/009/0005477177
"엔씨, ‘TL’ ‘톨랜드 쾌속 성장’ 이벤트·신규 콘텐츠 업데이트","엔씨소프트(공동대표 김택진, 박병무)는 MMORPG ‘THRONE AND LIBERTY’에 ‘톨랜드 쾌속 성장’ 이벤트와 신규 콘텐츠를 업데이트했다. ‘톨랜드 쾌속 성장’은 5월 28일까지 빠른 캐릭터 성장을 지원하",https://n.news.naver.com/mnews/article/009/0005477172
인디 게임에 진심인 네오위즈…올해도 신작 발굴 나선다,네오위즈가 다시 한번 인디게임 생태계의 든든한 후원자 역할에 나선다. 다년간 국내 인디게임 시장에서 꾸준한 성과를 쌓아온 네오위즈는 올해도 신작 발굴과 제작 환경 조성을 위한 다양한 행보를 예고했다. 이 회사는 20,https://n.news.naver.com/mnews/article/092/0002370816
"게임문화재단, 판교역 광장에서 도심형 게임축제 연다","게임문화재단이 도심형 게임축제 'GXG 2025'를 올해 9월 개최한다고 16일 밝혔다. 올해로 3회째 열리는 GXG 2025는 성남시가 주최하고 성남산업진흥원과 게임문화재단이 주관한다. 행사는 9월 19, 20일 ",https://n.news.naver.com/mnews/article/421/0008195676
"PvPvE 서바이벌 게임 '아크 레이더스', 30일 2차 테크니컬 테스트 진행","넥슨은 자회사 엠바크스튜디오에서 개발 중인 PvPvE 서바이벌 게임 '아크 레이더스'의 두 번째 테크니컬 테스트를 오는 30일부터 5월 4일까지 진행한다. 이번 테크니컬 테스트는 PC와 콘솔 플랫폼에서 진행되며, 크로스플레이를 지원한다. 공식 웹사이트와 스팀 상점 페이지에서 테스터 사전 등록이 가능하며, 기...",https://n.news.naver.com/mnews/article/236/0000248445
"포켓몬코리아, 추억 속 포켓몬 만나는 '메타몽의 타임캡슐' 운영","포켓몬코리아는 잠실 롯데월드몰 1층 아트리움에서 전시·판매 복합 공간 '메타몽의 타임캡슐'을 오는 25일부터 5월 19일까지 운영한다.'메타몽의 타임캡슐'은 처음 포켓몬을 만났던 날의 추억부터, 포켓몬 타운 2025에서 마주하는 감동까지 메타몽과 함께 시간 여행을 떠나는 듯한 테마...",https://n.news.naver.com/mnews/article/236/0000248444
"'프리프 유니버스', 24일 국내 출시 앞두고 사전 예약 시작","위메이드맥스의 자회사 위메이드커넥트는 웹기반 MMORPG '프리프 유니버스'의 국내 서비스를 오는 24일 시작한다.   '프리프 유니버스'는 지난 2022년 해외 시장에 먼저 선보였다. 원작 '프리프 온라인'을 기반으로 갈라랩이 개발하고, 위메이드커넥트와 비피엠지가 공동으로 글로...",https://n.news.naver.com/mnews/article/236/0000248443
"‘검은사막-아침의 나라’, 우두머리 신규 난이도 팔·구·십재시니 추가",펄어비스는 ‘검은사막-아침의 나라’에 우두머리 도전 콘텐츠 ‘검은사당 동해도편’에 ‘금돼지왕’ 우두머리 신규 난이도 팔/구/십재시니를 16일 추가했다. ‘검은사당’은 ‘검은사막-아침의 나라’와 함께 선보인 우두머리 ,https://n.news.naver.com/mnews/article/009/0005477169
"스피릿 테일즈, 23일 웹툰 호랑이형님 협업 콘텐츠 선봬","컴투스홀딩스는 모바일/PC MMORPG '스피릿 테일즈'와 네이버웹툰 '호랑이형님'의 협업 콘텐츠를 오는 23일 업데이트한다. '호랑이형님'은 네이버웹툰 대표작 중 하나로, 신비한 힘을 지닌 아이를 둘러싼 반인반수 흰눈썹의 야망과 동양 판타지 세계관 속 호랑이들의 전투를 그린다....",https://n.news.naver.com/mnews/article/236/0000248442
"넥슨 신작 '아크 레이더스', 30일 2차 테크니컬 테스트",넥슨은 자회사 엠바크 스튜디오가 개발 중인 서바이벌 액션 신작 '아크 레이더스' 두 번째 테크니컬 테스트를 30일부터 개시한다고 16일 밝혔다. 올해 정식 출시를 목표로 개발 중인 '아크 레이더스'는 익스트랙션 기반,https://n.news.naver.com/mnews/article/003/0013186466
"컴투스, '컴프야' 출시 10주년 맞이해 특별 이벤트 연다",컴투스(078340)가 '컴투스프로야구2025' 출시 10주년을 맞이해 특별 이벤트를 실시한다고 16일 밝혔다. 2015년 4월 16일 출시된 컴투스프로야구는 16일 10번째 생일을 맞았다. 이번 시즌에는 뛰어난 활,https://n.news.naver.com/mnews/article/421/0008195557
