기사 제목,내용,링크
IT일반 20250416, , 
"쿠첸, 천안 공장에 팔레타이징 로봇 도입",주방가전기업 쿠첸은 천안공장 밥솥 라인에 포장·적재 자동화를 위한 팔레타이징 로봇을 도입해 적재 자동화 시스템을 구축한다고 16일 밝혔다. 팔레타이징 로봇은 제조 공정이나 물류 창고에서 팔레트 위에 제품이나 상자를 ,https://n.news.naver.com/mnews/article/092/0002370952
"GC녹십자 혈액제제 ‘알리글로’, 과기부 장영실상 수상… “바이오 기술력·혁신성 입증”",GC녹십자는 혈액제제 ‘알리글로(ALYGLO)’가 제106회 ‘IR52 장영실상’을 수상했다고 16일 밝혔다. IR52 장영실상은 과학기술정보통신부가 주최하는 시상이다. 신기술 제품과 기술혁신 성과가 우수한 연구조직,https://n.news.naver.com/mnews/article/020/0003628827
"LIG넥스원, 시큐리티플랫폼과 국방 AI·무인체계 보안 협력",LIG넥스원은 엣지 디바이스 보안 전문기업 시큐리티플랫폼과 인공지능(AI) 및 무인체계 보안분야 선도기술 확보를 위한 공동 연구에 나선다. LIG넥스원은 15일 서울사무소에서 시큐리티플랫폼과 국방 AI 및 무인체계 ,https://n.news.naver.com/mnews/article/092/0002370951
"위로보틱스, 웨어러블 로봇 윔S 출시",웨어러블 로봇 업체 위로보틱스는 차세대 개인용 보행보조 웨어러블 로봇 '윔S'를 출시한다고 16일 밝혔다. 윔S는 위로보틱스가 1년 만에 새롭게 선보인 개인용 웨어러블 로봇이다. 지난해 출시한 윔보다 크기를 줄이고 ,https://n.news.naver.com/mnews/article/092/0002370950
"""산학협력 20년,  기술이전 이제 질적 전환 필요하다"" 한목소리","""기술이전 제도의 정착과 양적 성장을 넘어, 이제는 창업과 산업화로 이어지는 실질적인 질적 전환이 필요하다."" 16일 제주 메종글래드호텔에서 열린 '2025 기술이전·사업화 컨퍼런스' 부대행사로 마련된 패널토의에서,",https://n.news.naver.com/mnews/article/008/0005181658
"현대엘리베이터, 상하이 공장에 태양광 설비 구축",현대엘리베이터가 중국 상하이 스마트캠퍼스 공장에 6MW 규모 태양광 발전설비를 구축했다고 16일 밝혔다. 설비는 오는 2분기부터 가동을 시작해 총 전력 사용량의 47%를 친환경 에너지로 대체한다. 충북 충주 스마트캠,https://n.news.naver.com/mnews/article/092/0002370948
"DN솔루션즈, 신입공채 지원자 2배 늘어",공작기계 업체 DN솔루션즈는 올해 상반기 신입사원 공개채용 서류 접수에 약 4천800명이 지원했다고 17일 밝혔다. 작년 상반기 신입 공채 지원자 2천200여명 대비 2배 이상 증가했다. DN솔루션즈는 연구·개발과 ,https://n.news.naver.com/mnews/article/092/0002370947
"레인보우로보틱스, 대전 과학행사서 로봇카페 선봬",로봇 플랫폼 전문기업 레인보우로보틱스는 로봇 푸드테크 전문기업 옐로펀트로봇과 오는 16~20일 대전컨벤션센터에서 열리는 2025 대전사이언스페스티벌에 참가한다고 16일 밝혔다. 양사는 로봇카페를 전시해 관람객들에게 ,https://n.news.naver.com/mnews/article/092/0002370946
"아주대·삼성종합기술원 연구팀, '반도체 고집적화' 핵심 신기술 개발",국내 연구진이 선택적 원자층 증착을 통해 반도체 공정의 정밀도를 높일 수 있는 기술을 개발했다. 이에 미세화·고집적화가 진행되고 있는 차세대 반도체 소자 분야의 공정에서 중요하게 활용될 수 있을 전망이다. 16일 아,https://n.news.naver.com/mnews/article/119/0002946110
"에브리봇모빌리티, 교원라이프와 퍼스널 모빌리티 사업 협력",에브리봇 자회사 에브리봇모빌리티는 상조회사 교원라이프와 퍼스널 모빌리티 판매 관련 협약을 체결했다고 16일 밝혔다. 에브리봇모빌리티는 이번 협약으로 교원라이프 회원들에게 에브리봇모빌리티 의료용 스쿠터 2종과 경량형 ,https://n.news.naver.com/mnews/article/092/0002370944
"오픈놀, 작년 연결매출 507억···전년보다 2배 상승","AI 기반 커리어 서비스 오픈놀(대표 권인택)은 지난해 연결 매출 507억원을 기록했다고 16일 밝혔다. 이는 전년(251억원) 대비 101% 상승한 수치다. 영업이익은 1억원 수준으로 소폭 줄었지만, 미니인턴 서비",https://n.news.naver.com/mnews/article/092/0002370942
"엔비디아 개장전 거래에서 7% 급락, 지수선물도 일제↓",엔비디아가 개장전 거래에서 7% 가까이 급락하고 있다. 16일(현지시간) 뉴욕증시 개장전 거래에서 엔비디아는 6.87% 급락한 104.49달러를 기록하고 있다. 이는 트럼프 행정부가 엔비디아의 인공지능(AI) 전용 ,https://n.news.naver.com/mnews/article/421/0008197587
대전은 지금 ‘호기심 천국’…3대 과학행사 통합 개최,[앵커] 과학의 달을 맞아 우리나라의 대표적인 과학축제 3개가 대전에서 통합해 열립니다. 올해 주제는 '호기심'이라고 하는데요. 과학기술 연구 성과를 친숙하게 즐길 수 있는 다양한 체험이 기다리고 있습니다. 양민오 ,https://n.news.naver.com/mnews/article/056/0011933323
“韓 과학기술 현재와 미래” 한눈에 조망…대한민국 과학기술축제 개막,- 3개 대형 과학기술행사 최초 통합 개최 유상임 과학기술정보통신부 장관이 16일 오후 대전광역시 유성구 대전컨벤션센터에서 열린 ‘2025 대한민국 과학기술축제 개막식’ 에 참석해 기념촬영을 하고 있다. 정희권(앞줄,https://n.news.naver.com/mnews/article/016/0002458455
“엎치락 뒤치락” 아이폰 ‘판매량’ 첫 1위…삼성은 ‘출하량’ 1위 수성,"애플, 삼성 제치고 사상 첫 1분기 판매량 점유율 1위 출하량 1위는 삼성 서울 중구 명동 애플스토어에서 고객들이 아이폰16을 살펴보고 있다. [임세준 기자] [헤럴드경제=차민주 기자] 전 세계 스마트폰 시장이 포화",https://n.news.naver.com/mnews/article/016/0002458453
"현대홈쇼핑, 유망 스타트업 찾는다…""지원금 1천만원""","현대홈쇼핑은 서울시 창업기관인 서울경제진흥원, 스타트업 분석 플랫폼 운영사인 마크앤컴퍼니와 함께 유망 스타트업을 발굴 및 지원하는 'H.I.G.H(Hyundai Innovation Growth Hub)' 프로그램을 ",https://n.news.naver.com/mnews/article/092/0002370940
"SK스토아, ‘홀베리 유기농 레몬자몽즙’ 판매",SK스토아(대표 양맹석)는 ‘홀베리 유기농 레몬자몽즙’을 출시한다고 16일 밝혔다. 17일 오후 8시 31분 방송을 통해 선보이는 이 상품은 지난해부터 홈쇼핑 업계에서 가장 큰 히트작으로 떠오른 ‘홀베리 1일 1레몬,https://n.news.naver.com/mnews/article/092/0002370939
“내 일상은 AI 학습용 자료가 아니다” 메타·엑스의 이용자 개인정보 무단 활용에 시민사회 ‘반발’,"“내 일상은 인공지능(AI) 학습용이 아니다.” 메타, 엑스 등 소셜미디어가 AI 학습에 이용자 개인정보를 무단 활용하고 있다며 시민사회가 반발하고 나섰다. 디지털시민권리사업단은 16일 온라인 기자간담회를 열어 “메",https://n.news.naver.com/mnews/article/032/0003363826
"시민단체 ""AI 개발 명분으로 개인정보 침해 받아들이지 말아야""",내 일상은 인공지능(AI) 학습용이 아니다 국내 시민단체가 해외 주요 사회관계망서비스(SNS) 운영사들이 이용자 개인 정보를 AI 학습 데이터로 무단 사용했다고 비판하고 나섰다. 이들은 페이스북·인스타그램 등을 운영,https://n.news.naver.com/mnews/article/469/0000859946
"쿠팡, 고령군 농가 500곳 손잡고 딸기·수박 매입","쿠팡이 경상북도 고령군과 손잡고 지역 농·특산물의 온라인 판로 확대 및 신규 매입 확대를 위한 업무협약(MOU)을 체결했다고 16일 밝혔다. 이번 협약을 통해 쿠팡은 고령군의 500여 개 농가와 협력해 딸기, 수박,",https://n.news.naver.com/mnews/article/092/0002370937
"KT, '미디어 뉴웨이' 전략 발표…AI로 IPTV·콘텐츠 제작 혁신","지니 TV에 LLM 기반 AI 에이전트 도입 FAST·숏폼 등 신사업으로 수익 다변화 시동 KT가 16일 서울 강남구 안다즈 서울 강남 호텔에서 기자간담회 'KT그룹 미디어토크'를 개최, 'KT 미디어 뉴웨이' 전략",https://n.news.naver.com/mnews/article/629/0000382624
"위버스마인드, 더위크 중국어’ 출시","뇌새김을 운영하는 AI 에듀테크 기업 위버스마인드(대표 정성은)가 ‘더위크 중국어’를 출시한다고 16일 밝혔다. ‘더위크 중국어’는 성조와 발음부터 일상 및 비즈니스 실무에 적합한 중급 회화, HSK 대비까지 가능한",https://n.news.naver.com/mnews/article/092/0002370936
"삼성 간신히 1위, 애플 맹추격…‘관세폭탄’ 직전 스마트폰 성적",전세계 스마트폰 시장에서 삼성전자가 근소한 격차로 1위를 차지했다. 애플은 지속적인 성장세에 따라 1위를 맹추격하고 있다. 16일 시장조사업체 카운터포인트리서치 마켓 모니터 서비스의 잠정 집계에 따르면 올 1분기 전,https://n.news.naver.com/mnews/article/138/0002194801
"아이온큐 ""美 군사위성·드론 통신에 韓 기술 적용""","'양자컴퓨터 대표 기업' 피터 채프먼 회장 단독 인터뷰 韓 인텔리안테크와 손잡고 실제 전투 현장에서 쓰는 양자 기반 네트워크 구축 ""챗GPT 등장 후 AI 폭발처럼 제조·의료 등 상용화 잇따라 양자컴도 확산 모멘트 ",https://n.news.naver.com/mnews/article/009/0005477650
"대전시, '2025 대한민국 과학기술축제' 오늘 개막",대전시와 과학기술정보통신부는 오늘(16일)부터 20일까지 '2025 대한민국 과학기술 축제'를 대전 엑스포 시민광장 등에서 개최한다고 밝혔습니다. 올해 축제는 대전시의 사이언스페스티벌과 과기부의 과학축제 등을 통합한,https://n.news.naver.com/mnews/article/422/0000731770
[단독] “직원들 모두에 비서 준다”…시간 효율 높이려 LG가 택한 방법은,직원용 비서 ‘엘지니’ 한층 강화 조주완 CEO “직원 시간 돌려주겠다” 연내 ‘개인비서’ 기능도 추가 예정 회의 녹음만 하면 자동 정리·발송 월평균 35만건 AI 답변 처리 중 LG전자가 사내 챗봇 서비스인 ‘엘지,https://n.news.naver.com/mnews/article/009/0005477644
"[현장]티빙·웨이브 합병에 ""주주 가치에 맞나"" 직격탄 던진 KT 미디어부문장",국내 대표 온라인동영상서비스(OTT)로 꼽히는 티빙과 웨이브의 합병에 공개 입장을 밝히지 않던 KT가 불편한 속내를 드러냈다. KT가 티빙의 주요 주주이기는 하지만 티빙의 모회사 CJ ENM과 웨이브를 보유한 SK스,https://n.news.naver.com/mnews/article/469/0000859935
"[집중인터뷰] 대전서 국내 최대 과학축제 개최, 즐길 거리는?",[앵커] 앞서 보신 것처럼 국내 최대 규모의 과학축제가 대전에서 개막했는데요. 이와 관련해 축제를 주관하고 있는 한국연구재단 홍원화 이사장과 더 자세한 이야기 나눠봅니다. 어서오세요. 작년에 이어 올해도 '대한민국 ,https://n.news.naver.com/mnews/article/056/0011933212
"신세계라이브쇼핑 임직원, 서울숲 ‘생생 정원’에서 봉사활동 펼쳐","신세계라이브쇼핑(대표 이석구)은 봄을 맞아 지난 15일 서울숲에 위치한 ‘생생 정원’에서 봉사활동을 진행했다고 16일 밝혔다. ‘생생 정원’은 작년 말 신세계라이브쇼핑과 서울시 동부공원여가센터, 서울그린트러스트의 상",https://n.news.naver.com/mnews/article/092/0002370930
"“티켓도 비싼데” 예쁜 쓰레기까지 사야 ‘진짜 팬’?…모두 거부한 월드스타 [지구, 뭐래?]",한 콘서트장에서 관객이 응원봉을 들고 있다.[X(구 트위터) 갈무리] “콘서트 티켓만 사면 되는 거 아니었어?” 콘서트장을 물들이고 있는 형형색색의 불빛. 관객 모두가 하나씩 들고 있는 ‘응원봉’은 웃돈을 주고서라도,https://n.news.naver.com/mnews/article/016/0002458432
대전은 지금 ‘호기심 천국’…3대 과학행사 통합 개최,[앵커] 과학의 달을 맞아 우리나라의 대표적인 과학축제 3개가 대전에서 통합해 열립니다. 올해 주제는 '호기심'이라고 하는데요. 과학기술 연구 성과를 친숙하게 즐길 수 있는 다양한 체험이 기다리고 있습니다. 양민오 ,https://n.news.naver.com/mnews/article/056/0011933190
"몰테일 해외 풀필먼트 서비스, 네이버 커머스솔루션마켓에 입점","커넥트웨이브의 해외법인 몰테일은 해외 상품 판매 셀러의 물류관리를 현지에서 원스톱으로 지원하는 ‘해외 풀필먼트’ 서비스가 네이버 커머스솔루션마켓에 공식 입점했다고 16일 밝혔다. 몰테일의 해외 풀필먼트는 쿠팡, G마",https://n.news.naver.com/mnews/article/092/0002370929
"11번가, 선물 특가 판매 '해피 패밀리데이' 진행","11번가는 16일부터 ‘해피 패밀리데이' 기획전을 시작하며 본격적인 ‘가정의 달’ 마케팅에 나선다고 이날 밝혔다. 고물가 속 어린이날, 어버이날 선물을 합리적으로 장만할 수 있도록, 오는 5월 6일까지 브랜드별 제품",https://n.news.naver.com/mnews/article/092/0002370927
"“동의 없이 인스타 사진으로 AI 학습”…메타·X, ‘개인정보 침해’ 신고",메타와 엑스(X·옛 트위터)가 에스엔에스(SNS) 이용자 개인정보를 인공지능(AI) 모델 개발에 무단으로 활용하고 있다는 의혹에 대해 시민단체가 정부의 조사를 촉구했다. 진보네트워크센터·정보인권연구소는 16일 “메타,https://n.news.naver.com/mnews/article/028/0002741307
"정보세계정치학회, `플랫폼 국가론` 주제로 제1차 글로벌 디지털 포럼 17일 개최","정보세계정치학회(KAWPI)는 강훈식 의원실과 함께 오는 17일 대한상공회의소에서 '트럼프 2기 출범 100일, '플랫폼 국가론'으로 본 정부-기업 관계의 전환과 한국' 주제로 학회 특별세미나인 제1차 글로벌 디지털",https://n.news.naver.com/mnews/article/029/0002948672
"KT, '지니TV'에 GPT-4o 기반 '한국형 AI에이전트' 심는다",KT가 마이크로소프트(MS)와 함께 오픈AI의 대규모언어모델(LLM) GPT-4o 기반으로 제작하는 AI 에이전트를 IPTV 플랫폼 '지니TV'에 도입한다. KT는 이를 시작으로 미디어 사업 전반에 걸쳐 AI 전환(,https://n.news.naver.com/mnews/article/293/0000066212
"[fn 이사람] ""업무 흐름 끊는 검색시간… AI로 확 줄일 것""","""'인공지능(AI)을 활용한 전 세계 사무직 노동자의 삶 혁신'이 최종 목표다. 이를 위해 기업의 방대한 데이터를 효과적으로 관리하고, 필요한 정보를 적시에 제공하는 AI 솔루션 개발에 박차를 가하고 있다."" 16일",https://n.news.naver.com/mnews/article/014/0005337051
"2025 대한민국 과학기술축제 개막…""역대 최대 규모""","'2025 대한민국 과학기술축제'(과학기술축제)가 개막했다. 올해 주제는 '과학기술의 엔진, 호기심을 깨우다'로 다양한 과학기술로 호기심을 자극하는 약 850여개의 프로그램이 준비됐다. 과학기술정보통신부는 2025 ",https://n.news.naver.com/mnews/article/421/0008197453
韓 과학기술축제 역대 최대 규모로 개최…3개 대형 행사 합쳤다,올해 대한민국 과학기술축제가 역대 최대 규모로 진행된다. 기존에 제각각 개최했던 3개의 대형 과학기술행사가 하나로 통합된다. 온 가족이 즐길 수 있는 다양한 과학기술문화 프로그램부터 우리나라의 연구개발(R,https://n.news.naver.com/mnews/article/003/0013188313
역대 최대 규모 '2025 대한민국 과학기술축제' 열렸다,"역대 최대 규모 과학기술축제 '2025 대한민국 과학기술축제'가 20일까지 대전 도심 일대에서 열린다. 과학기술정보통신부(이하 과기정통부), 대전광역시가 주최하고 한국과학창의재단, 한국연구재단, 대전관광공사, 과학문",https://n.news.naver.com/mnews/article/008/0005181616
역대 최대 규모 '대한민국 과학기술축제' 개막,"대한민국과학축제와 대한민국과학기술대전, 대전사이언스페스티벌 등 3개 행사를 통합한 역대 최대 규모의 과학기술축제인 '대한민국 과학기술축제'가 성대하게 개막했다. 과학기술정보통신부와 대전광역시가 주최하고 한국과학창의재",https://n.news.naver.com/mnews/article/277/0005579159
토스서 KT알파 '기프티쇼' 모바일 상품권 구매 가능,KT알파(대표 박승표)가 운영하는 모바일 상품권 서비스 기프티쇼가 모바일 금융 서비스 토스(운영사 비바리퍼블리카)에 모바일 상품권을 공급한다고 16일 밝혔다. 토스를 이용하는 고객이라면 토스의 브랜드콘 서비스를 통해,https://n.news.naver.com/mnews/article/092/0002370925
"제조업 전반에 AI 이식...삼성SDS, ‘인더스트리 데이’서 디지털 혁신 사례 공유",삼성SDS는 16일 서울 잠실 스카이31 컨벤션에서 제조 기업을 대상으로 ‘제조의 미래를 준비하는 삼성SDS Industry Day’ 세미나를 개최했다고 밝혔다. 이번 세미나는 삼성SDS만의 차별화된 생성형 인공지능,https://n.news.naver.com/mnews/article/009/0005477623
티빙·웨이브 합병 수순에 입 연 KT...“주주가치 부합하는지 의문”,KT가 최근 토종 OTT 플랫폼 티빙과 웨이브의 합병 움직임과 관련해 주주 가치에 부합하지 않다는 공식 입장을 16일 밝혔다. 현재 웨이브의 1대 주주인 SK스퀘어와 티빙의 최대 주주인 CJ ENM은 웨이브에 총 2,https://n.news.naver.com/mnews/article/009/0005477622
“美 관세 전쟁에 전세계 스마트폰 시장 역성장 우려”,카운터포인트리서치 조사 출하량 기준 삼성 1위 탈환 애플은 매출 역대 최대치 미국 도널드 트럼프 정부에서 시작한 관세 전쟁으로 시장 불확실성이 커지고 있는 가운데 올해 전 세계 스마트폰 시장이 ‘마이너스 성장률’을 ,https://n.news.naver.com/mnews/article/009/0005477620
"멀어지는 AI G3… ""AI 투자·생태계 활성화 대책 시급""",AI 인덱스 2025 보고서 분석 지난해 민간투자 1위 '미국' 1090억달러로 중국에 11.7배 韓 13.3억달러… 11위 머물러 글로벌 인공지능(AI) 경쟁이 날로 심화되면서 경제와 산업의 규모에서 비롯되는 격차,https://n.news.naver.com/mnews/article/029/0002948654
"갤럭시 신화 이끈 노태문 ""신사업·판매단 운영 집중""","삼성전자 디바이스경험(DX)부문장 직무대행을 맡은 노태문 모바일경험(MX)사업부장(사진)은 16일 MX사업부 구성원들에게 미래 신사업 발굴, 판매단 운영 등에 집중하겠다고 밝혔다. 노 직무대행은 이날 MX사업부 임직",https://n.news.naver.com/mnews/article/014/0005337007
원하는 영화 말하면 찾아준다… 지니TV에 대화형 AI 적용,KT가 미디어 인공지능(AI) 에이전트를 지니 TV에 탑재한다. 미디어 콘텐츠 인공지능 전환(AX) 전문 조직도 신설해 기획·제작·유통 등 콘텐츠 밸류체인 전 과정에 AI를 적용한다. 광고 기반 무료 스트리밍 채널(,https://n.news.naver.com/mnews/article/014/0005337006
"SK C&C, NH농협 슈퍼앱 구축… 고객중심 디지털 금융 완성",SK C&C가 농협중앙회와 NH농협은행이 공동 추진한 'NH농협 디지털금융 플랫폼 전환 구축 사업'을 성공적으로 완료했다고 16일 밝혔다. 이번 사업을 통해 농협중앙회 'NH콕뱅크'와 NH농협은행 'NH올원뱅크'가 ,https://n.news.naver.com/mnews/article/014/0005337003
“이러면 제주도 안 간다” ‘10만원’ 짜리 갈치구이 난리더니…역대급 대박났다?,“제주 관광이 비싸다는 이유가 뭔지 분석해 보니 갈치구이가 대표 사례로 지적되고 있다.” (오영훈 제주도지사 발언 중) 제주도를 포함한 국내 대표 여행지 내 바가지요금 등 불신이 커지면서 해외여행 수요가 적잖이 늘고,https://n.news.naver.com/mnews/article/016/0002458416
가상자산 투자지표 '업비트 데이터 랩' 개편,두나무가 운영하는 '업비트 디지털 자산 지수(UBCI)'가 투자자 중심의 통합 데이터 플랫폼인 '업비트 데이터 랩'으로 개편됐다. 업비트 데이터 랩은 섹터별 시가총액과 가상자산 등락률 등 시장 흐름을 직관적으로 파악,https://n.news.naver.com/mnews/article/014/0005336997
"""우리 강아지가 사람이라면 어떻게 생겼을까?""…챗GPT 이번 유행은 '이것'",지브리·디즈니 화풍으로 생성한 이미지에 이어 반려동물을 사람처럼 바꾸는 '동물의 인간화'가 새로운 챗GPT 유행으로 떠오르고 있다. 15일(현지 시간) 뉴욕포스트는 최근 챗GPT를 활용해 자신의 반려동물을 사람처럼 ,https://n.news.naver.com/mnews/article/011/0004474936
"인덴트, 브이리뷰 AI 접근성 강화…제품 가격 및 구독 정책 개편",커머스 인공지능 전환(AX) 전문 기업 인덴트코퍼레이션이 AI 리뷰 수집 솔루션 '브이리뷰'의 구독 정책과 서비스 제공 범위를 전면 개편한다고 16일 밝혔다. 이번 개편은 AI 기술 발전에 따른 원가 절감 효과를 나,https://n.news.naver.com/mnews/article/029/0002948647
"미코 밸리마키 ""韓, 양자컴 인프라 갖춰…생태계 구축 나설 때""","“양자컴퓨터는 미래 기술이 아닙니다. 지금 이 순간에도 실제 환경에서 가동되고 있습니다.” 핀란드 양자컴퓨터 기업 IQM의 미코 밸리마키 공동 최고경영자(CEO·사진)는 16일 “양자컴퓨터는 신약 개발 시뮬레이션, ",https://n.news.naver.com/mnews/article/015/0005120197
"""턱시도 고양이 사람으로 바꿔줘""…지브리 이은 챗GPT 유행","내 반려동물이 사람이라면 어떤 모습일까? 반려동물을 키우는 사람이라면, 이런 상상을 한 번쯤 해보았을 텐데요. 최근 반려동물을 사람처럼 바꾸는 챗 GPT 이미지 생성이 유행하고 있습니다. 현지시간 14일 뉴욕포스트는",https://n.news.naver.com/mnews/article/422/0000731733
관세전쟁에 반도체 장비 '빅3'도 타격…'수퍼 을' ASML도 실적 악화,도널드 트럼프 미국 행정부의 관세 정책으로 반도체 장비 제조업체들이 연간 10억달러(약 1조4천300억원) 이상의 비용 부담을 추가로 떠안게 될 것으로 추산된다. 15일(현지시간) 로이터통신에 따르면 미국 3대 반도,https://n.news.naver.com/mnews/article/088/0000942444
'예외는 없다' 엔비디아도 못 피한 관세 폭탄…'K-반도체'도 된서리,"'자국 우선주의'를 내세운 도널드 트럼프 미국 행정부의 급진적인 관세 정책이 인공지능(AI) 반도체 시장에 찬 물을 끼얹었다. 15일(현지시간) 로이터 통신, 미 일간 뉴욕타임스(NYT) 등에 따르면 미 상무부는 엔",https://n.news.naver.com/mnews/article/088/0000942443
"LG엔솔, 일본·유럽 기업과 ESS 공급 논의","LG에너지솔루션이 일본, 유럽 기업 다수와 에너지저장장치(ESS) 배터리 공급을 논의 중이라고 밝혔다. 16일 LG에너지솔루션은 일본 전자 기업 오므론에 리튬인산철(LFP) ESS 배터리를 공급한다는 언론 보도 관련",https://n.news.naver.com/mnews/article/092/0002370922
"[게시판] KCA-한국로봇산업진흥원, 로봇 산업 활성화 협약",▲ 한국방송통신전파진흥원(KCA)은 한국로봇산업진흥원(KIRIA)과 로봇 서비스 확산과 산업 활성화를 위한 업무협약(MOU)을 맺었다고 16일 밝혔다. 두 기관은 로봇 산업에 정보통신기술(ICT) 적용을 확대해 경쟁,https://n.news.naver.com/mnews/article/001/0015334806
"""AI 기업, 데이터 생산자에 경제적 보상 해야""","김성훈 업스테이지 대표 최근 '지브리 프사(프로필 사진)' 열풍을 불러온 오픈AI의 챗GPT 이미지 생성 기능이 데이터 저작권을 침해한다는 비판이 이어지는 가운데, 해외 업체에 비해 국내 인공지능(AI) 기업이 데이",https://n.news.naver.com/mnews/article/009/0005477600
오픈AI도 SNS 개발 머스크 X와 정면승부,X(옛 트위터)를 소유한 일론 머스크와 사사건건 대립하고 있는 오픈AI가 이제는 X를 겨냥한 새로운 사회관계망서비스(SNS)를 내놓는다. 특히 전 세계적인 챗GPT 붐을 일으킨 지브리풍 이미지 제작 열풍에 맞춰 그림,https://n.news.naver.com/mnews/article/009/0005477598
