기사 제목,내용,링크
"LGU+, 국회 과방위원 초청…""AI 기술력 강화 방안 논의""",LG유플러스(032640)와 국회 과학기술정보방송통신위원회(과방위) 소속 위원들이 국내 AI 기술력 강화 방안을 논의했다. LG유플러스는 15일 오전 서울 강서구 LG사이언스파크에 과방위원 및 관계자 50여 명을 초,https://n.news.naver.com/mnews/article/421/0008193128
"LGU+, 국회 과방위와 AI 기술력 강화 논의…엑사원·익시젠 등 시연",LG유플러스가 국회 과학기술정보방송통신위원회 소속 위원들과 국내 인공지능(AI) 기술력 강화 방안을 논의했다. LG유플러스와 LG AI연구원은 자체 개발한 AI 언어모델을 과방위원들에게 선보이며 자사 기술 역량을 강,https://n.news.naver.com/mnews/article/003/0013184073
"LGU+, 사이언스파크에 국회 과방위원 초청...AI 기술력 강화 논의","LG유플러스와 국회 과학기술정보방송통신위원회(과방위) 소속 위원들이 국내 AI(인공지능) 기술력 강화 방안을 논의했다. LG유플러스는 15일 오전 서울 강서구 LG사이언스파크에 과방위원 및 관계자 50여명을 초청해,",https://n.news.naver.com/mnews/article/008/0005180639
"LG유플러스-국회 과방위, 국내 AI 기술력 강화 방안 논의",LG유플러스가 국회 과학기술정보방송통신위원회(과방위)와 함께 국내 인공지능(AI) 기술력 강화를 위한 방안을 논의했다. LG유플러스는 15일 서울 강서구 LG사이언스파크에서 과방위 소속 국회의원과 관계자 50여명을 ,https://n.news.naver.com/mnews/article/417/0001070966
서울시 '스마트서울뷰' 해외 진출 시동…사우디와 협력 논의 첫발,"서울시의 데이터 기반 행정서비스 '스마트서울뷰'가 해외 진출 가능성을 타진하며, 정책 협력 논의의 첫발을 뗐다. 15일 서울시에 따르면 지난 10일 사우디아라비아 자치행정주택부 국가지휘통제본부 등 정부 관계자가 방문",https://n.news.naver.com/mnews/article/030/0003303423
조현범의 '소통 혁신'…임원 100명 참여 'AI 단톡방' 운영,한국앤컴퍼니(000240)그룹이 그룹사 임원 100여명이 참여하는 '인공지능 단톡방'(IAA·Insight AI Agent)의 운영을 시작했다고 15일 밝혔다. IAA에는 조현범 한국앤컴퍼니그룹 회장을 비롯해 미래 ,https://n.news.naver.com/mnews/article/011/0004474208
"NXP, 새로운 MCX 시리즈 MCU 출시…IoT와 산업 자동화 '게임체인저' 노린다","글로벌 반도체 기업 NXP반도체는 최신 마이크로컨트롤러(MCU) 제품군인 MCX 시리즈를 공개했다. 이 시리즈는 IoT, 산업 자동화, 스마트 가전, 웨어러블, 모터 제어 등 다양한 분야에서 활용을 염두에 두고 설계",https://n.news.naver.com/mnews/article/030/0003303419
"""관세 실현 시 美 AI 학습 비용 33% 증가…韓 기회 될 수도""","트럼프 2기 행정부의 신규 관세 정책이 인공지능(AI)·반도체 산업의 최대 변수로 떠올랐다. 예고된 관세가 실제로 적용되는 경우, 미국 내 AI 학습 비용이 기존 대비 33% 수준까지 증가할 수 있다는 분석이 제기된",https://n.news.naver.com/mnews/article/092/0002370651
지구 궤도 덮은 ‘우주쓰레기’…하루 3개씩 위성·로켓 추락 중 [핵잼 사이언스],오래된 위성이나 로켓 파편 등 ‘우주쓰레기’가 매일 최소 3개씩 지구에 떨어지고 있다는 분석이 나왔다. 갈수록 우주쓰레기가 증가해 지구 대기 오염과 지상 안전에 대한 우려도 커지고 있다. 우주쓰레기는 인류가 우주 공,https://n.news.naver.com/mnews/article/081/0003533570
"""갤S25로 바꾸자"" 100만명 우르르…삼전 말고도 이 회사들 웃었다","삼성전자가 최근 선보인 '갤럭시S25' 흥행으로 올해 2월 기기변경(스마트폰 살 때 통신사 그대로 유지) 건수가 16개월 만에 100만건을 넘어섰다. 이와 함께 번호이동과 신규가입 건수도 덩달아 늘면서, 침체했던 통",https://n.news.naver.com/mnews/article/008/0005180628
"와이즈넛, AI 검색 품질 높인다… ‘벡터검색 솔루션’ 조달 등록 완료","AI 에이전트 전문기업 와이즈넛(대표 강용성)은 인공지능 검색 솔루션 Search Formula-1 V7(서치포뮬러원, 이하 SF-1 V7)의 벡터 에디션을 신규 출시함과 동시에 조달청 디지털서비스몰 정식 등록을 완",https://n.news.naver.com/mnews/article/020/0003628347
"""캐논 EOS R로 포착한 알프스 대자연""…'Wonder of Valais' 전시",캐논코리아가 스위스 발레(Valais)주의 대자연을 담은 사진전 'Wonder of Valais'를 다음 달 6일까지 캐논갤러리에서 개최한다고 15일 밝혔다. 전시는 캐논코리아가 선발한 11인의 사진작가와 영상감독이,https://n.news.naver.com/mnews/article/421/0008193081
부산 사상공단 제조기업 스마트화 속도 높인다,부산 사상공업지역 일반산업단지 내 제조업체들의 디지털 스마트 설비 전환 활성화를 위해 기업 협·단체와 공공기관이 손을 맞잡았다. 부산정보산업진흥원은 지난 14일 오후 ㈔사상기업발전협의회와 ‘사상구 소재 기업 설비 디,https://n.news.naver.com/mnews/article/014/0005336051
엔비디아 “美서 4년간 700조 규모 AI 인프라 생산”,"엔비디아가 4년간 미국에서 5000억 달러(약 700조원) 규모 AI 인프라를 생산할 계획이라고 14일(현지시간) 밝혔다. 엔비디아는 블로그를 통해 이같은 계획을 발표하고, 12~15개월 내 AI 슈퍼컴퓨터 대량양산",https://n.news.naver.com/mnews/article/030/0003303416
"애플, 1분기 글로벌 스마트폰 판매 1위…삼성전자 2위",애플이 2025년 1분기 글로벌 스마트폰 판매에서 1위를 차지했다. 14일(현지시간) 카운터포인트리서치 발표에 따르면 애플은 1분기 글로벌 시장 점유율 19%를 기록했다. 지난해 같은 분기 대비 4% 성장했다. 카운,https://n.news.naver.com/mnews/article/421/0008193059
"인스웨이브, 창립 23주년 맞아 전사 워크숍 진행",인공지능(AI)·디지털전환(DX) 전문기업 인스웨이브(대표 어세룡)가 지난 11일 서울 청계산 일대에서 전사 워크숍을 개최했다고 15일 밝혔다. 사명 변경 이후 첫 공식 행보다. 이번 행사는 창립 23주년을 기념해 ,https://n.news.naver.com/mnews/article/030/0003303415
"유온로보틱스, 성주월항농협APC와 AI 로봇 농산물 자동 포장 시스템 첫 가동",비전 인공지능(AI) 전문 기업 시선AI(구 씨유박스)의 로봇 부문 자회사 유온로보틱스가 성주월항농협산지유통센터(APC)와 AI 로봇 자동 포장 시스템 상용화에 대한 기술 검증(PoC)을 진행한다고 15일 밝혔다. ,https://n.news.naver.com/mnews/article/030/0003303413
"카카오엔터테인먼트, 4월 화제의 신작 웹툰 4종 공개","카카오엔터테인먼트가 4월 화제의 신작 웹툰 4종을 공개했다. 카카오엔터테인먼트는 카카오페이지에서 '나는 한 편의 극을 보았다'와 '암흑명가 천재 망나니가 되었다', 카카오웹툰에서 '연습생'과 '허약선생'을 신작으로 ",https://n.news.naver.com/mnews/article/421/0008193045
"파수, 'FDI 2025' 22일 개최…""AI 시대 전략 소개""",파수가 연례행사 'FDI 2025 심포지움'을 오는 22일 서울 여의도 페어몬트 앰버서더 호텔에서 개최한다고 15일 밝혔다. 올해 주제는 '생성형 인공지능(AI) 혁명: AI가 기업에 가져올 변화'다. 파수는 기업용,https://n.news.naver.com/mnews/article/008/0005180620
"""생성형AI 트렌드 짚고 기업 활용 지원"" 22일 여의도 파수 FDI",파수(150900)는 이달 22일 서울 영등포구 여의도 페어몬트 앰버서더 호텔에서 회사의 대표 고객초청 콘퍼런스 'FDI 2025 심포지엄'(이하 FDI)을 개최한다고 15일 밝혔다. 올해 FDI 주제는 '생성형 인,https://n.news.naver.com/mnews/article/421/0008193036
"현대차그룹, 美 워싱턴사무소장에 공화당 4선의원 선임",현대자동차그룹은 내달 1일자로 드류 퍼거슨 전 미국 연방하원의원을 신임 HMG워싱턴사무소장에 선임한다고 15일 밝혔다. 드류 퍼거슨 신임 HMG워싱턴사무소장은 앞으로 미국 정부 및 의회와 현대차그룹 사이 소통을 총괄,https://n.news.naver.com/mnews/article/092/0002370649
"비행기 타면 자동으로 인터넷 연결…SKT, ‘T 기내 와이파이 자동 로밍’ 출시",SK텔레콤이 기내 와이파이 이용 절차를 간소화한 ‘T 기내 와이파이 자동 로밍’을 출시했다고 15일 밝혔다. T 기내 와이파이 자동 로밍은 이용자가 탑승 전 서비스에 가입하면 별도의 인증 절차 없이 자동으로 기내 와,https://n.news.naver.com/mnews/article/032/0003363381
"LG CNS, '구글 클라우드’와 아시아·태평양 시장 선점 나선다",LG CNS가 구글 클라우드와 아태·미주 지역에서 클라우드 기반 인공지능 전환(AX)사업 다각화에 나선다고 15일 밝혔다. 양사는 전 산업 분야에서 AX사업 협력을 강화한다는 방침이다. LG CNS는 클라우드·AI ,https://n.news.naver.com/mnews/article/015/0005119351
"오픈AI, `GPT-4.1` API로 공개…""코딩·효율성↑""","챗GPT 개발사 오픈AI가 새로운 인공지능(AI) 모델 'GPT-4.1'을 14일(현지시간) 공개했다. GPT-4.1은 기본모델과 'GPT-4.1 미니' 및 'GPT-4.1 나노' 등 3종으로 구성됐고, 우선 응용프",https://n.news.naver.com/mnews/article/029/0002948184
"중부발전, 스웨덴 구바버겟 풍력사업 재무적 준공 달성",한국중부발전(대표 이영조)은 45%의 지분을 보유한 스웨덴 구바버겟 풍력 발전사업이 2025년 4월부로 재무적 준공을 성공적으로 달성하고 최초 배당 13억원을 시행한다고 밝혔다. 재무적 준공이란 금융 계약상의 준공으,https://n.news.naver.com/mnews/article/092/0002370647
"SK C&C, 장애 청년 ICT 인재 양성 '씨앗 얼라이언스' 간담회 개최","SK C&C가 15일 경기 성남시 판교디지털훈련센터에서 장애 청년 정보통신기술(ICT) 인재 양성을 위한 '2025년 씨앗 얼라이언스 간담회'를 개최했다. 씨앗은 SK C&C가 한국장애인고용공단 서울맞춤훈련센터, 판",https://n.news.naver.com/mnews/article/030/0003303408
"인텔, FPGA 자회사 알테라 지분 51% 매각...사업 재편 본격화",인텔이 지난 해 초 분사한 프로그래머블 반도체(FPGA) 자회사인 알테라(Altera) 경영권을 미국 사모펀드인 실버레이크 파트너스에 넘겼다. 양사가 14일(이하 현지시간) 공동 보도자료로 이렇게 밝혔다. 인텔은 알,https://n.news.naver.com/mnews/article/092/0002370646
[IT리더스포럼]방승찬 ETRI 원장 “'AI의 총화'는 로봇...연구역량 집중해야”,"“인공지능(AI)은 하루가 다르게 발전하고, 새로운 것이 등장하고 있습니다. 관련된 모든 요소 연구개발(R&D)에 나서야 하고, 특히 'AI 로봇' 구현에 집중해야 합니다.” 정보통신기술(ICT), AI 등 디지털 ",https://n.news.naver.com/mnews/article/030/0003303407
"원자력연-美에너지부 아르곤국립연, 차세대 원전 공동연구 확대",한국원자력연구원이 미국 에너지부(DOE) 산하 아르곤국립연구소(ANL)와 소듐냉각고속로(SFR)·가상원자로 등 차세대원자력시스템 분야에서의 공동연구를 새롭게 추진한다. 한국원자력연구원(이하 원자력연)은 주한규 원장이,https://n.news.naver.com/mnews/article/008/0005180615
"SK브로드밴드 AI 셋톱박스, '레드닷 디자인 어워드' 본상",AI 2·AI Sound Max 셋톱박스 이어 세 번째 SK브로드밴드가 지난해 출시한 'AI 4 vision' 셋톱박스가 '레드닷 디자인 어워드 2025' 프로덕트 디자인 부문에서 본상을 수상했다고 15일 밝혔다. ,https://n.news.naver.com/mnews/article/629/0000382026
"오케스트로, 220억 규모 K-클라우드 과제 수주…국산 AI반도체 클라우드 선도",오케스트로가 과학기술정보통신부와 정보통신기획평가원(IITP)이 추진하는 'AI반도체를 활용한 K-클라우드 기술개발 R&D 사업'에서 총 220억 원 규모 연구개발 과제 2건을 수주했다. 오케스트로는 이번 과제를 통해,https://n.news.naver.com/mnews/article/030/0003303401
"사이냅소프트, 구글 워크스페이스용 '사이냅 문서뷰어' 사용자 100만명 넘어서","사이냅소프트의 구글 워크스페이스용 사이냅 문서뷰어가 글로벌 누적 사용자 100만명을 돌파했다. 구글 워크스페이스용 사이냅 문서뷰어는 구글드라이브, 지메일을 포함한 구글 워크스페이스 전반에서 아래아한글(HWP, HWP",https://n.news.naver.com/mnews/article/030/0003303400
"LG전자, ‘AI 바람’ 탑재한 에어컨 ‘휘센 쿨’ 출시","LG전자는 15일, 공감지능(AI)을 적용한 스탠드형 에어컨 ‘휘센 쿨’ 신제품을 출시했다고 밝혔다. 휘센 쿨은 AI가 생활 환경과 사용 패턴을 학습해 최적의 바람을 제공하는 ‘AI 바람’ 기능을 탑재했고, 사용 후",https://n.news.naver.com/mnews/article/144/0001032753
"와디즈 글로벌 서비스 5월 출시...""메이커 모집""","와디즈(대표 신혜성)가 5월 글로벌 서비스 출시를 앞두고, 전 세계로 도약할 K 펀딩 메이커를 모집한다고 15일 밝혔다. 와디즈 글로벌 서비스는 국내 메이커들이 크라우드펀딩을 통해 해외 첫 고객을 확보하고, 글로벌 ",https://n.news.naver.com/mnews/article/092/0002370644
"라온시큐어 컨소시엄, 정부 양자내성암호 시범사업 선정",라온시큐어는 과학기술정보통신부·한국인터넷진흥원(KISA)의 '양자내성암호(PQC) 시범전환 지원사업'에서 자사 컨소시엄(연합체)이 의료분야 사업자로 선정됐다고 15일 밝혔다. 라온시큐어 컨소시엄은 양자내성암호 기반 ,https://n.news.naver.com/mnews/article/008/0005180611
"온세미, 알레그로 10조 인수 제안 철회",온세미컨덕터는 알레그로 마이크로시스템즈에 제안한 약 69억 달러(약 9조8235억원) 인수 계획을 철회한다고 14일(현지시간) 밝혔다. 온세미는 차량용 반도체 역량 강화를 목적으로 알레그로를 주당 35.10달러에 전,https://n.news.naver.com/mnews/article/030/0003303396
"라이너, 블라인드 공동창업자 출신 김성겸 총괄 영입",글로벌 인공지능(AI) 검색 스타트업 라이너가 글로벌 시장 확대와 비즈니스 전략 고도화를 위해 블라인드 공동창업자 출신 김성겸 총괄이사를 영입했다. 김 총괄은 라이너 글로벌 사용자 성장과 비즈니스 전략을 총괄하는 사,https://n.news.naver.com/mnews/article/030/0003303394
"사진 '한 장'으로 초실사 AI 아바타 만든다…ETRI, 차세대 인터페이스 기반 구현","인물 사진 한장만으로 사람처럼 자연스럽게 말하는 초실사 인공지능(AI) 아바타 생성 기술이 국내에서 개발됐다. 정교한 표정, 입 모양 표현으로 실제 사람과 같은 자연스러운 대화가 가능해 보다 인간 친화적인 사용자 경",https://n.news.naver.com/mnews/article/030/0003303393
"KT클라우드, 영업·투자 현금흐름 동반 개선...인프라 확대 정조준",KT클라우드가 지난해 영업·투자 현금흐름을 동시에 개선하며 재무건전성을 크게 높였다. 설비투자가 안정된 상황에서 운전자본을 효율적으로 관리한 덕에 영업활동현금흐름이 2배 가까이 증가했다. 영업활동현금흐름은 기업의 영,https://n.news.naver.com/mnews/article/293/0000066117
"GS네오텍, AWS 생성형 AI 컴피턴시 획득",GS네오텍이 아마존웹서비스(AWS)의 '생성형 인공지능(AI) 컴피턴시'를 획득했다. AWS 생성형 AI 컴피턴시는 AI 기술 분야에 대한 파트너사의 전문성과 기술력을 엄격하게 심사해 인증하는 AWS 공식 전문화 프,https://n.news.naver.com/mnews/article/030/0003303392
"베스핀글로벌 일본 합작 법인 '지젠', 구글 클라우드 올해의 데이터·분석 파트너상 수상",베스핀글로벌의 일본 합작 법인 지젠이 구글 클라우드 파트너 어워드에서 '2025년 올해의 데이터 및 분석 파트너상'을 수상했다. 이번 수상은 구글 클라우드 생태계 활동 성과와 데이터 활용을 통한 비즈니스 성장 기여도,https://n.news.naver.com/mnews/article/030/0003303391
‘아르테미스’ 프로그램 참여 확대…韓·美 우주동맹 강화된다,"- 제4차 한미 민간우주대화 개최 - 양국 우주 협력 강화 방안 논의 제4차 한미 민간우주대화에 참석한 관계자들이 기념촬영을 하고 있다. 존 리(왼쪽부터) 우주항공청 본부장, 한민영 외교부 기후환경과학외교국장, 라히",https://n.news.naver.com/mnews/article/016/0002457342
"LG, 청소년 꿈 키우는 '찾아가는 AI 랩' 가동",LG가 미래 주역인 청소년이 창의적 인재로 성장할 수 있도록 돕는 '찾아가는 AI 랩' 프로그램 가동을 시작했다. LG는 경상남도 진주시 사봉면 반성중학교에서 올해 첫 '찾아가는 AI 랩'을 진행했다고 15일 밝혔다,https://n.news.naver.com/mnews/article/030/0003303389
"지코어, AI 이미지 생성 플랫폼 렛츠AI에 고성능 AI 인프라 공급","지코어가 인공지능(AI) 기반 이미지 생성 플랫폼 기업 렛츠AI에 고성능 AI 인프라와 AI 추론 솔루션 '에브리웨어 인퍼런스'를 공급했다. 렛츠AI는 사용자가 직접 업로드한 이미지, 스타일, 제품 등을 기반으로 맞",https://n.news.naver.com/mnews/article/030/0003303388
"와이즈넛, AI 검색 '서치포뮬러원' 벡터 조달 등록",인공지능(AI) 에이전트 전문기업 와이즈넛이 AI 검색 솔루션 '서치포뮬러원(SF-1 V7)' 벡터 에디션을 신규 출시하고 조달청 디지털서비스몰에 정식 등록했다. 와이즈넛은 이미 공공시장에 진출한 SF-1 V7의 벡,https://n.news.naver.com/mnews/article/030/0003303385
"SKT·SK텔링크, 기내 와이파이 자동 로밍 세계 최초 출시",SK텔레콤은 SK텔링크와 개발한 ‘T 기내 와이파이 자동 로밍’ 서비스를 대한항공 일부 항공편에서 출시했다고 15일 밝혔다. ‘T 기내 와이파이 자동 로밍’은 이용자가 탑승 전 서비스에 가입하면 별도의 인증 절차 없,https://n.news.naver.com/mnews/article/144/0001032749
"엔비디아 ""美서 4년간 700조원 규모 AI 인프라 생산 계획""(종합)","AI 슈퍼컴퓨터 첫 미국서 생산…""수요 충족·공급망 강화"" 파트너사 5곳 중 4곳 대만 기업…1곳은 한국계 앰코테크놀로지 김태종 특파원 = 인공지능(AI) 칩 제조업체 엔비디아는 향후 4년간 파트너사들과 미국에서 최",https://n.news.naver.com/mnews/article/001/0015330414
"게임 개발기부터 차량용 설루션까지…유니티,기술 생태계 집대성",게임·3D 콘텐츠 제작 플랫폼 유니티의 글로벌 개발자 콘퍼런스가 막을 올렸다. 유니티는 '유나이트 서울 2025'가 서울 코엑스에서 개막한다고 15일 밝혔다. '유나이트 서울 2025'는 개발 전 부문을 지원하는 엔,https://n.news.naver.com/mnews/article/421/0008192969
"LG CNS, 구글 클라우드와 아태·미주 AX 시장 공략",LG CNS가 구글 클라우드와 아시아태평양·미주지역 클라우드 기반 인공지능 전환(AX) 시장 공략을 본격화한다. 15일 LG CNS에 따르면 현신균 LG CNS 사장은 최근 미국 라스베가스에서 열린 '구글 클라우드 ,https://n.news.naver.com/mnews/article/030/0003303382
"AMD ""TSMC N2 공정서 차세대 서버용 프로세서 '베니스' 생산""",AMD는 내년 출시 예정인 차세대 서버용 에픽(EPYC) 프로세서 '베니스'(Venice)를 대만 TMSC의 2나노급 N2 공정에서 생산할 예정이라고 15일 밝혔다. 베니스는 AMD 차세대 x86 프로세서 아키텍처인,https://n.news.naver.com/mnews/article/092/0002370641
"KOSA, 청년 대상 IT 기업 취업·성장 지원…청년미래플러스 참여자 모집",한국소프트웨어산업협회(KOSA)가 정보기술(IT) 기업 취업 희망 청년과 중소·중견 IT 기업 저연차 청년의 취업·성장을 지원한다. KOSA는 이러한 내용을 골자로 하는 고용노동부 주관 청년미래플러스 사업 참여자를 ,https://n.news.naver.com/mnews/article/030/0003303377
"아이나비시스템즈, 네덜란드 톰톰과 파트너십 계약",팅크웨어 자회사 아이나비시스템즈가 네덜란드 위치정보 기술 전문 기업인 톰톰과 글로벌 전역을 대상으로 한 솔루션 공급 파트너십 계약을 체결했다고 15일 밝혔다. 이번 계약을 통해 아이나비시스템즈는 특수 목적 경로탐색 ,https://n.news.naver.com/mnews/article/031/0000924576
"안랩, AI 플랫폼 '안랩 AI 플러스' 출시",안랩이 자사 보안정보를 기반으로 구축한 인공지능(AI) 플랫폼 '안랩 AI 플러스'를 출시했다고 15일 밝혔다. 안랩 AI 플러스의 특징은 △생성형 AI와 거대언어모델(LLM) 기반 지능형 보안 탐지·분석 강화 △다,https://n.news.naver.com/mnews/article/008/0005180595
미 ‘민감 국가’ 효력 오늘부터 발효 전망,미국 에너지부가 한국을 민감국가 명단에 올린 조치가 오늘(15일)부터 발효될 것으로 보입니다. 이에 따라 당분간 한미 간 과학기술 및 연구 협력에 차질이 빚어질 수 있다는 우려가 나옵니다. 이 조치가 발효되면 한국 ,https://n.news.naver.com/mnews/article/056/0011931876
"SK C&C '씨앗 간담회' 개최…""장애청년 ICT인재 양성""",SK C&C가 15일 한국장애인고용공단 서울맞춤훈련센터·판교디지털훈련센터와 경기 성남시 판교디지털훈련센터에서 장애 청년 정보통신기술(ICT) 인재 양성을 위한 '2025년 씨앗(SIAT) 얼라이언스 간담회'를 개최했,https://n.news.naver.com/mnews/article/008/0005180592
"고용 한파 속, 채용 플랫폼 작년 성적 비교해보니","지난해 채용 플랫폼 업계는 고용 시장의 불확실성과 투자 심리 위축이라는 이중 압박을 받으며 각기 다른 전략을 폈다. 그 결과 각사마다 서로 다른 성적표를 받았는데, 채용 시장의 한파가 실적에 고스란히 묻어났다. 지난",https://n.news.naver.com/mnews/article/092/0002370639
"파비안 보덴슈타이너 월드 유럽 매니징 디렉터 ""AI 시대 신뢰는 기술로 증명해야 한다""","""사람과 사람이 온라인에서 서로를 신뢰할 수 있도록 만드는 기술. 그것이 우리가 한국 시장에 제안하고 있는 핵심이다."" 파비안 보덴슈타이너 월드 유럽 매니징 디렉터는 지난 14일 서울에서 진행된 인터뷰에서 이와 같이",https://n.news.naver.com/mnews/article/092/0002370638
"“퇴행성 뇌질환 정복” 韓-英, R&D 협력 가속도 낸다",- 한국뇌연구원·영국 뇌질환플랫폼사업단과 공동연구 국제심포지움 한국뇌연구원-영국 뇌질환플랫폼사업단(DPUK) 공동연구 국제심포지움 주요 참석자들이 기념촬영을 하고 있다.[한국뇌연구원 제공] 한국뇌연구원(KBRI)은 ,https://n.news.naver.com/mnews/article/016/0002457322
'프렌즈 스크린 퀀텀' 창업 지원 설명회서 창업 상담 100명,카카오 VX가 실제 골프장 필드를 실감하도록 구현한 스크린 골프 시스템 '프렌즈 스크린 퀀텀(Q)'의 창업지원 설명회를 개최했다고 15일 밝혔다. 지난 10~12일 서울 삼성동 코엑스에서 진행된 '프렌즈 스크린 퀀텀,https://n.news.naver.com/mnews/article/421/0008192935
"LG전자,  '휘센 쿨' 에어컨 신제품 출시…AI 에어컨 라인업 확대",LG전자가 공감지능(AI)을 적용한 다양한 '휘센 쿨' 신제품을 출시했다. 휘센 쿨은 AI가 고객의 생활 환경과 사용 패턴을 학습해 최적의 바람을 제공하는 'AI 바람'을 탑재했다. 사용 이후에는 내부에 남을 수 있,https://n.news.naver.com/mnews/article/030/0003303371
"성남시, 재활용선별장에 '자원 선별 AI 로봇' 추가 설치",조달청 시범사업 선정…재활용 플라스틱 선별량 하루 1.8t으로 확대 경기 성남시는 조달청이 공모한 올해 '제1차 혁신제품 시범구매 사업'에 선정돼 인공지능(AI) 기반의 자원 선별 로봇을 분당구 야탑동 재활용선별장에,https://n.news.naver.com/mnews/article/001/0015330371
"과기정통부·TTA, 블록체인 서비스 신뢰성 검증·컨설팅 지원",과학기술정보통신부와 한국정보통신기술협회(TTA)는 국내 블록체인 기업의 기술 경쟁력 강화 및 산업 활성화를 위해 블록체인 신뢰성 검증 시험 및 컨설팅 지원 대상 기업을 다음 달 2일까지 모집한다고 15일 밝혔다. T,https://n.news.naver.com/mnews/article/421/0008192908
